Id|sentence|span|bio
1267|What I do know is that I live on a small Island and it seems that a lot of people from various countries in the world are willing to desert their homelands and their families just to come here , in my mind that tells me a lot about said people and their home countries , most of all it highlights their weaknesses of how their own countries have let them down and how they feel the need to feed off somebody elses country , how should we English interpret this without sounding rude ? ? ? , locust ? ? ? , parasite ? ? ? , you tell me . |{'start': [98, 103], 'end': [98, 103]}|O O O O O O O O O O O O O O O O O O O O O O O O O O O O O O O O O O O O O O O O O O O O O O O O O O O O O O O O O O O O O O O O O O O O O O O O O O O O O O O O O O O O O O O O O O O O O O O O O O B O O O O B O O O O O O O O
1268|gb turned into an faggoty and muzzie orwellian shithole on lizzie watch f all these so called nobles they should be dangling from lampposts|{'start': [4, 8], 'end': [6, 8]}|O O O O B I I O B O O O O O O O O O O O O O O O
1269|@user I hope that dumb cunt gets her face beat in by a black woman over hearing her using the word nigga .|{'start': [4, 13, 21], 'end': [5, 13, 21]}|O O O O B I O O O O O O O B O O O O O O O B O
1270|They not sending their best . A lot of them are rapists scumbags and the lowest form of DNA . Should THIS fake familyâ not be separatedÃ #StopTheInvasion #DeportThemAll #NoAmnesty #BuildTheWall @user|{'start': [11, 27, 28, 30], 'end': [12, 27, 28, 30]}|O O O O O O O O O O O B I O O O O O O O O O O O O O O B I O B O
1271|Talking of shitholes, I have to go to Londonistan tomorrow #LondonHasFallen.|{'start': [2, 8, 10], 'end': [2, 8, 10]}|O O B O O O O O B O B
1272|i just asked a young kid about pewdiepie using the nigger word in a video his reply was who cares i agreed with the sentiment and congratulated him on his common sense|{'start': [10], 'end': [10]}|O O O O O O O O O O B O O O O O O O O O O O O O O O O O O O O O
1273|#Buildthatwall #Deportthemall @user : More Needless Deaths at the Hands of an Illegal Alien , and an Oregon Ballot Initiative |{'start': [0, 1, 12], 'end': [0, 1, 13]}|B I O O O O O O O O O O B I O O O O O O
1274|If they love Sharia law so much, why do not they go off and live in a Muslim country?|{'start': [2, 11], 'end': [4, 18]}|O O B I I O O O O O O B I I I I I I I
1275|There are too many differences between Muslims and us, for example Muslims have different laws from us.|{'start': [2, 11], 'end': [8, 14]}|O O B I I I I I I O O B I I I O O
1276|CA - well now . Then your votes wont count if you allow illegal aliens to vote . THAT IS AN AMERICAN PRIVILEGE ! ! #BuildThatWall|{'start': [13, 25], 'end': [14, 25]}|O O O O O O O O O O O O O B I O O O O O O O O O O B
1277|you bitches are real life weirdos|{'start': [1], 'end': [1]}|O B O O O O
1278|Finally a person who represents westerners, we hate Islam!|{'start': [7], 'end': [8]}|O O O O O O O B I
1279|sudden death omg by tyler glenn really is that bitch|{'start': [9], 'end': [9]}|O O O O O O O O O B
1280|im a sensitive bitch who takes shit too seriously|{'start': [3, 6], 'end': [3, 6]}|O O O B O O B O O
1281|Islam is a plague infecting our planet.|{'start': [0], 'end': [3]}|B I I I O O O
1282|when a hoe wants to talk about morals|{'start': [2], 'end': [2]}|O O B O O O O O
1283|The UK and us must fight Islam! Islam is intolerance, Quran, jihad, being gay, barbarism and so on. It is a disgusting cult!|{'start': [5], 'end': [22]}|O O O O O B I I I I I I I I I I I I I I I I I
1284|Hazel e is a joke . Girl you bashing dark skin women who all look better than you ! ! ! Wack ass hoe|{'start': [21], 'end': [23]}|O O O O O O O O O O O O O O O O O O O O O B I I
1285|ran it up with the same niggas|{'start': [6], 'end': [6]}|O O O O O O B
1286|Stfu you lie out the gate lol tf you except ! You want pussy out the gate ! !|{'start': [0, 13], 'end': [0, 13]}|B O O O O O O O O O O O O B O O O O O
1287|Here Illegally you are breaking the law ! The laws states you get deported not a choice ! You dont get to come to the U.S Illegally , feel Entitled Demand to stay , ake jobs from Citizens and steal U.S Resources #Trump #MAGA #SendThemHome @user |{'start': [1, 44], 'end': [1, 44]}|O B O O O O O O O O O O O O O O O O O O O O O O O O O O O O O O O O O O O O O O O O O O B O
1288|16 illegal aliens arrested - all were previously arrested or convicted of a variety of offenses including aggravated criminal sexual contact , aggravated assault , DUI , battery , theft , burglary , possession of a weapon , and forgery : @user |{'start': [1, 18], 'end': [2, 19]}|O B I O O O O O O O O O O O O O O O B I O O O O O O O O O O O O O O O O O O O O O O
1289|I wonder what the shegroid that came running up did .|{'start': [4], 'end': [4]}|O O O O B O O O O O O
1290|@user we have the same bday ... You should let me fuck your brains out and treat you like a cum dumpster on that day ... #Bdaygoals|{'start': [11, 20], 'end': [11, 21]}|O O O O O O O O O O O B O O O O O O O O B I O O O O O
1291|I ' ve seen negroes who look ( and undoubtedly act ) like him .|{'start': [4], 'end': [4]}|O O O O B O O O O O O O O O O
1292|Also . Some of you Latina women and your white people racism can also eat a giant dick . Cuz they don't like your ass either .|{'start': [9, 17, 24], 'end': [11, 17, 24]}|O O O O O O O O O B I I O O O O O B O O O O O O B O O
1293|@user See it WORKS ! #BuildThatWall #BuildTheWall|{'start': [5, 6], 'end': [5, 6]}|O O O O O B I
1294|Was getting elbowed by a triple chinned cunt with nails like a woman ont train Let a smelly fart out before moving @url|{'start': [7, 17], 'end': [7, 18]}|O O O O O O O B O O O O O O O O O B I O O O O
1295|tbh , NOT ALL men are trash / shit . Just because all fucking around with the wrong ones , you donâ get to call the whole race shit . |{'start': [6, 27], 'end': [6, 27]}|O O O O O O B O O O O O O O O O O O O O O O O O O O O B O O
1296|niggaz was fat in the good old days and they usually died of heartattacks by fitty from crack cocaine and chasing white women dat nigger found jesus and a guru|{'start': [0, 24], 'end': [0, 24]}|B O O O O O O O O O O O O O O O O O O O O O O O B O O O O O
1297|@user PS - take off that picture-any picture of you makes me want to puke ! Any women that would side with Trump is not for any woman or their rights that they should have . You are just another lying Skank GOP white piece of trash ! Your commerci|{'start': [41], 'end': [41]}|O O O O O O O O O O O O O O O O O O O O O O O O O O O O O O O O O O O O O O O O O B O O O O O O O O
1298|you all think dolphins have a form of what up my nigga|{'start': [11], 'end': [11]}|O O O O O O O O O O O B
1299|Yes , more homosexual degeneracy foisted upon the silent majority . |{'start': [3], 'end': [3]}|O O O B O O O O O O O
1300|#BuildThatWall #IllegalAliens @user . @user Eric Lang , CEO Yarrabee Farms admitted did not use EVerify for this killer or workers . Tell AG . @user to get off his behind work on getting EVerify mandatory 4all jobs . Hopefully ICE raids YarebeeFarms as regular visit |{'start': [0, 1], 'end': [0, 1]}|B I O O O O O O O O O O O O O O O O O O O O O O O O O O O O O O O O O O O O O O O O O O O O
1301|Muslims are invading London. There are more Muslims than Londoners in London. #londinistan #LondonHasFallen.|{'start': [2, 6, 12], 'end': [3, 11, 13]}|O O B I O O B I I I I I I I
1302|@user You will NEVER see CNN / MSNBC call Linda Sarsour a racist or bigot . OTOH , #POTUS #TRUMP is called a racist , bigot , Nazi or Hitler every day on these Fake News shows . #MAGA #KAG #POTUS #Trump #NEWS #VoteRed #NoDACA #WalkAway #AmericaFirst #USA # |{'start': [12, 34, 45], 'end': [12, 34, 45]}|O O O O O O O O O O O O B O O O O O O O O O O O O O O O O O O O O O B O O O O O O O O O O B O O O
1303|he looks like another entitled nigger i know of|{'start': [5], 'end': [5]}|O O O O O B O O O
1304|@user #NoHR392 #NoDACA #NoH2b #BuildTheWall'Undocumented drunk driver ' killed Oregon couple on motorcycle via @user|{'start': [4, 8], 'end': [4, 8]}|O O O O B O O O B O O O O O O
1305|There is a war that involves us and the Muslims thet is lasting for a thousand years.|{'start': [3, 9], 'end': [3, 9]}|O O O B O O O O O B O O O O O O O
1306|British citizens can not find a job because of those Muslims being employed instead. It does not matter whether they have skills and experience or not. It is all about political correctness.|{'start': [10], 'end': [13]}|O O O O O O O O O O B I I I O O O O O O O O O O O O O O O O O O
1307|@user : They recruited buku fags in here ! ... a warehouse is no place for them !|{'start': [5], 'end': [5]}|O O O O O B O O O O O O O O O O O O
1308|Chain Migration Imported 120K Foreign Nationals from Terrorist-Funding Countries Since 2005 - Breitbart @user @user #EndChainMigration #EndDACA #NoAmnesty #EndBirthrightCitizenshipForIllegalAliens #BuildtheWall #KeepAmericaSafe|{'start': [16, 18, 19], 'end': [16, 18, 19]}|O O O O O O O O O O O O O O O O B O B I O
1309|Illegal Alien Hit Man , Dragged Him For Blocks In Deadly DUI Crash #BuildTheWall #NoAmnesty #NoDACA #DeportThemAll #KeepAmericaSafe |{'start': [0, 13, 16], 'end': [1, 13, 16]}|B I O O O O O O O O O O O B O O B O
1310|fanbloodytastic by time these leeches are held to account especially the muzzie scum taking wives breeding kids like rabbits in order to increase welfare payments potus ur simply the best|{'start': [4, 14], 'end': [12, 25]}|O O O O B I I I I I I I I O B I I I I I I I I I I I O O O O
1311|Nowadays the big problem in London is the presence of muslims, they must go away!|{'start': [2], 'end': [10]}|O O B I I I I I I I I O O O O
1312|@user you a fatherless wallet carrying ass video game playing ass negro breh . You filth . No way you can afford to date a #TwitterHoney .|{'start': [6, 10, 15], 'end': [6, 11, 15]}|O O O O O O B O O O B I O O O B O O O O O O O O O O O
1313|reverse it west yorkshire police are so good at their job no child raped by paki muslims on their watch asif|{'start': [12, 15], 'end': [13, 16]}|O O O O O O O O O O O O B I O B I O O O O
1314|Hoe be like  am cut from a different cloth first of all , you a napkin bitch|{'start': [5, 10], 'end': [5, 10]}|O O O O O B O O O O B O O O O O O
1315|The worst thing happened to internet freedoms when albanians used their spare time from selling drugs to learn to use computers .|{'start': [8], 'end': [8]}|O O O O O O O O B O O O O O O O O O O O O O
1316|Yes he should for life @user @user #BuildTheWall #LockHerUp #BoycottNike #BoycottNFL #EndDACA now|{'start': [7], 'end': [7]}|O O O O O O O B O O O O O
1317|Good Morning Patriots xx Let everything we do be done with them in mind . #WalkAwayFromDemocrats #BuildThatWall #MAGA #ChooseLife #VoteDemsOut #REDWAVE2018 #Midterms #VoteRED #TinyLivesAtStake|{'start': [15, 16], 'end': [15, 16]}|O O O O O O O O O O O O O O O B I O O O O O O O
1318|@user Yeah do the right thing and vote for the Sweden Democrats Sweden for Swedes not 3rd world rapefugee terrorists ! #MakeSwedenGreatAgain|{'start': [18], 'end': [18]}|O O O O O O O O O O O O O O O O O O B O O O
1319|why are we having all these people from shithole countries coming here|{'start': [6], 'end': [9]}|O O O O O O B I I I O O
1320|Illegal Alien Stabbed Mother Of Five To Death In Missouri via @user needless death ! @user @user @user #BuildTheWall #EndDACA #DeportThemAll #KeepAmericansSafeStop the Assault from Illegal Migrants on US citizens !|{'start': [0, 7, 18, 20, 25], 'end': [1, 7, 18, 20, 26]}|B I O O O O O B O O O O O O O O O O B O B O O O O B I O O O O
1321|pineapplecity : dogwhoreowner : Stupid cunt , that what the filthy whore deserves ! That how all Men ... @url|{'start': [2, 4, 5, 11], 'end': [2, 4, 5, 11]}|O O B O B I O O O O O B O O O O O O O O
1322|Fleeing for their lives , migrants trek for the US - TELL YOUR REPS NO MORE REFUGEES OR IMMIGRANTS @url|{'start': [5, 16, 18], 'end': [5, 16, 18]}|O O O O O B O O O O O O O O O O B O B O
1323|Here is a desperate , irrelevant clown looking to stay relevant . #MAGA #KAG #POTUS #NEWS #Trump #WalkAway #BuildTheWall #LockHerUp #USA #NoDACA #LiberalismIsAMentalDisorder #Flag #FridayFeeling #FridayMotivation #FakeNews |{'start': [17, 18, 26], 'end': [17, 18, 26]}|O O O O O O O O O O O O O O O O O B I O O O O O O O B
1324|@user @user B is for #BuildTheWall D is for #DeportThemAll T is for #TreasonTrials for those elected officials who did nothing save tolerate / encourage illegal immigration .|{'start': [5, 9, 25], 'end': [5, 9, 26]}|O O O O O B O O O B O O O O O O O O O O O O O O O B I O
1325|my baby blunt smoking bitch fuck with us suckin this niggers|{'start': [1], 'end': [10]}|O B I I I I I I I I I
1326|#potus must #buildthatwall my first ever msg on Twitter so I hope I'm doing this right . @user Donald Trump will not ever change or abandon us or #USA that's why I will be voting for him AGAIN ! Dems and worrying about votes will not change him , POTUS is THE MAN ! |{'start': [2], 'end': [2]}|O O B O O O O O O O O O O O O O O O O O O O O O O O O O O O O O O O O O O O O O O O O O O O O O O O O O O O
1327|wearing out their welcome on planet earth just as fast as their muzrat mates|{'start': [12], 'end': [12]}|O O O O O O O O O O O O B O
1328|what do you think is more likely the story or a nigger lied|{'start': [11], 'end': [11]}|O O O O O O O O O O O B O
1329|i have not once used a single kike source for anything the fact that you automatically assume that anybody who disagrees with herodotus is a kike says something about you i am merely referring to german historians who had disproven herodotus accounts by the mid 1600|{'start': [7, 25], 'end': [7, 25]}|O O O O O O O B O O O O O O O O O O O O O O O O O B O O O O O O O O O O O O O O O O O O O O
1330|time to pack it in and let the jews win guys some spic who shot up a school had a loose connection to some larping white nationalists|{'start': [12], 'end': [12]}|O O O O O O O O O O O O B O O O O O O O O O O O O O O
1331|@user @user Illegals are dumping their kids heres o they can get welfare , aid and U.S School Ripping off U.S Taxpayers #SendThemBack ! Stop Alowing illegals to Abuse the Taxpayer #Immigration @url|{'start': [2, 22, 26], 'end': [2, 22, 26]}|O O B O O O O O O O O O O O O O O O O O O O B O O O B O O O O O O
1332|Women and girls are harmed by Islamic that were allowed to enter in our country by our government.|{'start': [0], 'end': [6]}|B I I I I I I O O O O O O O O O O O
1333|old person : did you buy that shirt with holes in it ? me : yes it is called fashion bitch look it up|{'start': [21], 'end': [21]}|O O O O O O O O O O O O O O O O O O O O O B O O
1334|When Islam hasn't arrived yet in England, things was good. Now we are full of muslim rapists and it is evident that sexual violence is jihad in England.|{'start': [1, 13, 22], 'end': [9, 16, 25]}|O B I I I I I I I I O O O B I I I O O O O O B I I I O O
1335|honestly man most of you guys are nigger faggots|{'start': [7], 'end': [8]}|O O O O O O O B I
1336|your muzrat gov t will never allow brexit|{'start': [1], 'end': [7]}|O B I I I I I I
1337|idiot boy trudeau his somali moslem immigration minister ahmed hussen want to bring mildly retarded somali to canada to repopulate canada with the dumbest people on the face of the earth|{'start': [13], 'end': [14]}|O O O O O O O O O O O O O B I O O O O O O O O O O O O O O O O
1338|Uk is being islamized very fast. British government submits to every whim of Islam.|{'start': [0, 8], 'end': [3, 13]}|B I I I O O O O B I I I I I
1339|gab fam leaky weiner speak freely if you dont think nigger obama will pardon that crooked old lady you are kidding yourself classifiedinfomatters|{'start': [10], 'end': [10]}|O O O O O O O O O O B O O O O O O O O O O O O
1340|These liberal standards! Muslims are intolerant with other cultures, women and homosexuals, but our society protects them with this liberalist policy.|{'start': [3], 'end': [11]}|O O O B I I I I I I I I O O O O O O O O O
1341|@user @user sometimes WOMEN are stupid too ! Majority of white women voted for a sexist misogynist pig !|{'start': [10, 15], 'end': [10, 17]}|O O O O O O O O O O B O O O O B I I O
1342|jean is absolutely retarded and apparently a heeb dickrider|{'start': [2, 7], 'end': [3, 8]}|O O B I O O O B I
1343|@user We have to slap a bitch made hoe ass foo we gon make it look sessy hahaha|{'start': [6, 8], 'end': [6, 9]}|O O O O O O B O B I O O O O O O O O
1344|he a jew when it convenient for him and a fellow white person when thats more convenient just like literally every other kike|{'start': [22], 'end': [22]}|O O O O O O O O O O O O O O O O O O O O O O B
1345|@user @user now we have a Ebloa case in Texas . If we kill all the niggers we might be safe .|{'start': [16], 'end': [16]}|O O O O O O O O O O O O O O O O B O O O O O
1346|i am tired of niggas acting like carmelo anthony is trash|{'start': [4], 'end': [4]}|O O O O B O O O O O O
1347|chopra is a curry nigger who utters meaningless new age platitudes like only you can poison your soul|{'start': [3], 'end': [4]}|O O O B I O O O O O O O O O O O O O
1348|Benefits and access to our national health service must be stopped for Muslims. We should ban them from the UK!|{'start': [5, 15], 'end': [12, 16]}|O O O O O B I I I I I I I O O B I O O O
1349|People are afraid of Muslims rape gangs and the spread of extremism, even if you pretend not to see it.|{'start': [4, 9], 'end': [6, 11]}|O O O O B I I O O B I I O O O O O O O O
1350|Islam is not a faith, it is a motivation for stupid sexual disturbed persons and for criminals who contaminate the world.|{'start': [0, 10, 16], 'end': [4, 13, 20]}|B I I I I O O O O O B I I I O O B I I I I
1351|louis gutirerrez another dumb nigger in a suit|{'start': [4], 'end': [4]}|O O O O B O O O
1352|its a bloody good thing that muzzie cunt is gone|{'start': [6], 'end': [7]}|O O O O O O B I O O
1353|Hey guys please go here to help us send the Mexicans back to Mexico .|{'start': [8], 'end': [11]}|O O O O O O O O B I I I O O O
1354|@user We need our ARMY down there to #StopTheInvasion ! ! ! WHERE ARE THEY that is More Important than defending our national border against this constant onslaught of hostile foreign invaders ? ! ! ? ! ? ? !|{'start': [8], 'end': [8]}|O O O O O O O O B O O O O O O O O O O O O O O O O O O O O O O O O O O O O O O O
1355|#SaturdayMorning people think #IllegalImmigration is just about #BuildThatWall and #Jobs . . . no one talks about the fraud committed or money sucked out by #IllegalAliens from social services . . . #MAGA #KAG #trump #AmericaFirst #foxandfriends|{'start': [3, 25], 'end': [3, 25]}|O O O B O O O O O O O O O O O O O O O O O O O O O B O O O O O O O O O O O
1356|weinstein amazon vox gq the left is eating itself right now the deathmatch du jour is lecherous kikes versus cat ladies we need to meme a race war between nigs and beaners for money|{'start': [16, 29, 31], 'end': [17, 29, 31]}|O O O O O O O O O O O O O O O O B I O O O O O O O O O O O B O B O O
1357|"Fast-Food Workers Union Demands Restaurant to Allow Employees to Wear ' Abolish ICE ' Pins | Breitbart #BuildTheWALL #AmericaFirst #NoDACA #NoDEMS #GreatAwakening #MAGA #WalkAway #ThesePeopleAreSick #ICE"|{'start': [17, 23, 24], 'end': [17, 23, 24]}|O O O O O O O O O O O O O O O O O B O O O O O B I O
1358|@user they switch up like faggots|{'start': [4], 'end': [5]}|O O O O B I
1359|Now who has had the smile wiped off their face . @user you are a biatch #mkr|{'start': [15, 16], 'end': [15, 16]}|O O O O O O O O O O O O O O O B I
1360|When the populations are not seperated racial mixing occurs and that is genocide .|{'start': [6, 12], 'end': [7, 12]}|O O O O O O B I O O O O B O
1361|@user @user yes even radical muzzies planning to take over america over are running for office and just in congress i will not support the muslim brotherhood i am not stupid any more than i would vote for socialism screw the dems|{'start': [4], 'end': [5]}|O O O O B I O O O O O O O O O O O O O O O O O O O O O O O O O O O O O O O O O O O O
1362|It's unfair to immigrants apply and wait for a VISA to reside , work or go to school , here in the U.S . , that ILLEGAL ALIENS are allowed to stay without documentation . Let them go home and apply for a VISA like all the LEGAL IMMIGRANTS HAVE . WHAT MAKES ILLEGALS EXEMPT ? |{'start': [26], 'end': [27]}|O O O O O O O O O O O O O O O O O O O O O O O O O O B I O O O O O O O O O O O O O O O O O O O O O O O O O O O O
1363|Vote for question 69 . All girls must use birth control . I'm sick of wearing a rubber ! #WomenSuck|{'start': [19], 'end': [19]}|O O O O O O O O O O O O O O O O O O O B
1364|Islam is a cult and not a religion. They rape children, enslave and murder people, attack our values, and there is nothing good about it. It is incompatible with our way of life.|{'start': [0, 9], 'end': [7, 17]}|B I I I I I I I O B I I I I I I I I O O O O O O O O O O O O O O O
1365|#sexworkersagainstfeminism are invited to join the #blog . End #feminism today ! @url|{'start': [0], 'end': [0]}|B O O O O O O O O O O O O
1366|the iranian regime has a mosque in my home town thousands of miles from tehran its controlled by the revolutionary guard do not let the persian kike fool you|{'start': [26], 'end': [26]}|O O O O O O O O O O O O O O O O O O O O O O O O O O B O O
1367|Our children are being forced fed with this 'Islam' nonsense in schools. This is a disgrace.|{'start': [8], 'end': [9]}|O O O O O O O O B I O O O O O O
1368|in fact i can not find anything fuzzy or warm about my dutch ness we are a pretty dour people always having to stick our fingers in dykes while wearing wooden shoes does that to you|{'start': [23], 'end': [27]}|O O O O O O O O O O O O O O O O O O O O O O O B I I I I O O O O O O O O
1369|I gotta stop opening DMs when I'm drunk ... I wake up like who TF is this bitch and why did I send her a dick pic|{'start': [17, 25], 'end': [17, 25]}|O O O O O O O O O O O O O O O O O B O O O O O O O B O
1370|We never see them protesting against ISIS or the Saudi human rights abuses, etc.? Because they are a bunch of hypocrites.|{'start': [6, 20], 'end': [12, 20]}|O O O O O O B I I I I I I O O O O O O O B
1371|So many sluts texted Stephen when we got Lionel ' our cats look the same ! ' Bitch 95 % of house cats in the US are domestics , stay in your lane |{'start': [2, 17], 'end': [2, 17]}|O O B O O O O O O O O O O O O O O B O O O O O O O O O O O O O O O
1372|England is becoming a islamic country and the government succumbs to every caprice of Muslims.|{'start': [4, 9], 'end': [5, 14]}|O O O O B I O O O B I I I I I
1373|part and parcel of living in a big city london muzzie mayor sadiq khan|{'start': [10], 'end': [10]}|O O O O O O O O O O B O O O
1374|Illegal Alien With Long Criminal Record Murdered Man In North Carolina via @user #BuildTheWall #EnforceUSLaws #EndDaca #BanSanctuaryCities #KeepAmericansSafe|{'start': [0, 13], 'end': [1, 14]}|B I O O O O O O O O O O O B I O O O
1375|Illegal Alien Kidnapped , Raped 14 - Year-Old Girl In North Carolina @user @user @user There is no excuse for this ! #NoAmnesty #NoDACA #DeportThemAll #HonorYourOath #KeepAmericansSafe #BuildTheWall |{'start': [0, 4, 24, 27], 'end': [1, 4, 24, 27]}|B I O O B O O O O O O O O O O O O O O O O O O O B O O B
1376|As long as I live , I will be a Masculine Male with balls . There won't make ' women ' or ' eunuchs ' out of us ... |{'start': [13], 'end': [13]}|O O O O O O O O O O O O O B O O O O O O O O O O O O O O O
1377|haha holy fuck just try not to say that guy name in a squeaky hobgoblin yid voice|{'start': [1, 15], 'end': [2, 15]}|O B I O O O O O O O O O O O O B O
1378|Human Trafficking : Border Patrol Agents Take Down ' Stash Houses ' with 40 + Illegal Aliens #IllegalAliens #BuildTheWall #HumanTrafficking #MAGA #KAG #KeepAmericaGreat #DeportThemAll #WALKAWAY #NoDACA #NoAmnesty #DeportThemAll #Trump #PedoGate #RedPill|{'start': [15, 17, 18, 23, 27], 'end': [16, 17, 18, 23, 27]}|O O O O O O O O O O O O O O O B I I I O O O O B O O O B O O O
1379|Illegal Alien Awaiting Deportation For Child Rape , Now Caught Producing Child Porn @url|{'start': [0, 3, 6, 12], 'end': [1, 3, 6, 12]}|B I O B O O B O O O O O B O
1380|Muslims are staining the world, they are sexual maniacs with psychopathic tendencies. They use their religion as an excuse!|{'start': [0, 7, 13], 'end': [4, 11, 18]}|B I I I I O O B I I I I O B I I I I I
1381|@user Yeah ! Me too . My people , the women , laff at the set apart men ... they love the real niggas or niggers . |{'start': [23, 25], 'end': [23, 25]}|O O O O O O O O O O O O O O O O O O O O O O O B O B O
1382|He has found a person who publicly critisizes Islam and muslim radicalism, as all western people hate Islam.|{'start': [6, 14], 'end': [11, 17]}|O O O O O O B I I I I I O O B I I I
1383|Its a bitch who better get her some business forreal ! How the fuck u gone feel entitled to somebody ! Bitch u got blackballed & u gone stay blackballed ! I ain't saving no hoe ! U is not apart of my Spurs dreams ! The woman u see on my page had on the San Antonio Spurs Warm up Jacket|{'start': [2, 13, 21, 35], 'end': [2, 13, 21, 35]}|O O B O O O O O O O O O O B O O O O O O O B O O O O O O O O O O O O O B O O O O O O O O O O O O O O O O O O O O O O O O O O
1384|Female Logic : ' I HAVE to go through my hoe phase before I can become a real women and be in a relationship . '|{'start': [10], 'end': [10]}|O O O O O O O O O O B O O O O O O O O O O O O O O O
1385|Is it a fundamental principle of Islam that they have to pray in the street, or do they do it just to piss off us infidels?|{'start': [11, 22], 'end': [14, 25]}|O O O O O O O O O O O B I I I O O O O O O O B I I I
1386|@user want women to have equal rights unless you dont fit my exact definition of how a woman should be then you  are a hoe|{'start': [24], 'end': [24]}|O O O O O O O O O O O O O O O O O O O O O O O O B
