Id|sentence|span|bio
0|Say it loud , say it clear , illegal #immigrants are not welcome here @user |{'start': [8, 9], 'end': [8, 9]}|O O O O O O O O B I O O O O O
1|Islam is not a religion, its just an excuse for retarded sexual psychopaths, bastards who pollute the world.|{'start': [0, 10], 'end': [4, 13]}|B I I I I O O O O O B I I I O O O O
2|@user Care About Illegals Breaking U.S #Immigration laws abusing their kids to make a dangerous trip or sending them with Coyotes ! 73 % of Illegals on Welfare The U.S is Not Central America's Welfare State Red Hen #Ttrump #MAGA #BuildTheWall|{'start': [40], 'end': [40]}|O O O O O O O O O O O O O O O O O O O O O O O O O O O O O O O O O O O O O O O O B
3|Behold the future DACA America - unless we Man The F * ck Up and Deport the illegal aliens.Sooner or later this will be us , having to take to streets crying out for our fellow Americans to MAN THE F * CK UP and save our girls . #NoDACA |{'start': [10, 17], 'end': [14, 18]}|O O O O O O O O O O B I I I I O O B I O O O O O O O O O O O O O O O O O O O O O O O O O O O O O O O
4|No that little tattoo of a flower on your ankle doesn't make you a whore ... Or your trampstamp ... Fuck it , YOU'RE A WHORE #WomenSuck |{'start': [14, 20, 25, 26], 'end': [14, 21, 25, 26]}|O O O O O O O O O O O O O O B O O O O O B I O O O B I
5|I don't take you places because I wanna be friends . My car doesn't run on friendship bitch it runs on ethanol ! #WomenSuck|{'start': [17, 23], 'end': [17, 23]}|O O O O O O O O O O O O O O O O O B O O O O O B
6|I suppose they ' re trying to be funny , but it ' s really just an effort to continue demonizing Germans and propagating the Holocau $ t . |{'start': [21], 'end': [21]}|O O O O O O O O O O O O O O O O O O O O O B O O O O O O O
7|it really october and my car was hot in degrees when i got in it after work i fucking hate you boomers u ruined this planet and robbed us of our fall die off already fuck|{'start': [17], 'end': [35]}|O O O O O O O O O O O O O O O O O B I I I I I I I I I I I I I I I I I I
8|ira because i cannot get behind christians killing christians without fellow white people involvement especially considering the ira never once said a bad word about infinite nigger migration and the rapes that came with it|{'start': [25], 'end': [30]}|O O O O O O O O O O O O O O O O O O O O O O O O O B I I I I I O O O O
9|Take off those glasses ! They aren't real you hipster fuck ! #WomenSuck|{'start': [10, 12], 'end': [10, 12]}|O O O O O O O O O O B O B
10|sadiq khan london moslem mayor warns tory police cuts means future terror attacks more likely it is not police cuts that make terror attacks more likely it is the moslems in the uk who make terrorist attacks more likely|{'start': [29], 'end': [38]}|O O O O O O O O O O O O O O O O O O O O O O O O O O O O O B I I I I I I I I I
11|Honestly if they ever fired them I ' d expect they ' d do more damage to themselves since the average person lacks the intellect for basic firearms training .|{'start': [4], 'end': [4]}|O O O O B O O O O O O O O O O O O O O O O O O O O O O O O O
12|bitches broken heart|{'start': [0], 'end': [0]}|B O O
13|#AZmonsoon lot of rain , too bad it wasn't enough to wash away the teabagger racist white trash in the state . #Tcot #teaparty #azflooding |{'start': [15], 'end': [17]}|O O O O O O O O O O O O O O O B I I O O O O O O O
14|That bitch don't love you fr bro these hoes be lying|{'start': [1, 8], 'end': [1, 8]}|O B O O O O O O B O O
15|We'll never give up ... The jews can keep trying opening our borders and sending their third world minions after the European people but WE WILL NEVER CAPITULATE ...|{'start': [6], 'end': [6]}|O O O O O O B O O O O O O O O O O O O O O O O O O O O O O
16|They are often confused with whites when they hide their tail , horns , and hooves . |{'start': [5], 'end': [5]}|O O O O O B O O O O O O O O O O O
17|you all niggers are cancers|{'start': [2], 'end': [4]}|O O B I I
18|i hope the niglets keep going down on their knees its the only realistic depiction of blacks on fake news tv any chance of getting t shirts made that say @user boycott nfl tebow rule cant pray owners are pleased with their blacks down on their knees|{'start': [0, 42], 'end': [20, 46]}|B I I I I I I I I I I I I I I I I I I I I O O O O O O O O O O O O O O O O O O O O O B I I I I
19|Islam is thinked to be a different culture, but actually is a cruelty, a group of beliefs similar to Nazism.|{'start': [12, 14], 'end': [12, 19]}|O O O O O O O O O O O O B O B I I I I I
20|Just shows how thick they actually are one farmer-one bullet they will just end up starving and asking WHITES to feed them|{'start': [18], 'end': [18]}|O O O O O O O O O O O O O O O O O O B O O O
21|you can see the gook genes|{'start': [4], 'end': [4]}|O O O O B O
22|aw i was hoping it was the owner of salon not some chink you owns a salon <sad>|{'start': [12], 'end': [16]}|O O O O O O O O O O O O B I I I I O
23|I guess the Yonge St retail district will be smashed and looted .|{'start': [11], 'end': [11]}|O O O O O O O O O O O B O
24|i guess the nigger have been to busy to kill off this mudshark|{'start': [3, 9], 'end': [3, 12]}|O O O B O O O O O B I I I
25|These feral negroes stalk white women , rape and kill and , no one seems willing to stop them . |{'start': [2, 4, 7, 9], 'end': [2, 4, 7, 9]}|O O B O B O O B O B O O O O O O O O O O
26|@user the house negro is always the first to defend the master is the white dic that good @user|{'start': [2, 14], 'end': [3, 15]}|O O B I O O O O O O O O O O B I O O O
27|I hope @user gets Ebola and then hit by a train followed by a smack in the ugly face with a shovel #mkr #katandandre #mkrkat|{'start': [4, 7, 22, 24], 'end': [4, 10, 22, 24]}|O O O O B O O B I I I O O O O O O O O O O O B O B
28|@user @user This is the reason women in Hollywood are treated like whores . If it looks like a whore and @url|{'start': [19], 'end': [19]}|O O O O O O O O O O O O O O O O O O O B O O
29|in the end who gives a shit if salma hayek got paid to dyke out and now regrets it just another bs accusation from an aging actress|{'start': [13], 'end': [13]}|O O O O O O O O O O O O O B O O O O O O O O O O O O O
30|@user Its a joke . The picture on the right is an actual photograph of a rapefugee chimping out in Germany recently . Just happens to match the older photoshop beautifully .|{'start': [16], 'end': [16]}|O O O O O O O O O O O O O O O O B O O O O O O O O O O O O O O O
31|the way he sees it is that whites are evil he is at war with whites sall good he rich now nigger rich|{'start': [21], 'end': [22]}|O O O O O O O O O O O O O O O O O O O O O B I
32|It appears the left is out of control in Germany as well , son murder and he is the bad guy , they are crazy for sure @user @user #BuildTheWall #LockThemUp #EndDACA #BoycottNFL #BoycottNike enough already |{'start': [14, 29, 30], 'end': [14, 29, 30]}|O O O O O O O O O O O O O O B O O O O O O O O O O O O O O B I O O O O O
33|Worldbank reports that in the next 30 years many refugees have to leave her homeland , specially in Africa . Who will feed them ? Is Europe able to shoot them down and protect her own homeland , before it will destroyed from Africans ? @user |{'start': [43], 'end': [43]}|O O O O O O O O O O O O O O O O O O O O O O O O O O O O O O O O O O O O O O O O O O O B O O
34|they would be cracking nigger skulls and navy skulls|{'start': [4], 'end': [4]}|O O O O B O O O O
35|fuck what this kike cunt has to say only thing she is good for is sticking a cock down her throat so she can not talk|{'start': [3, 15], 'end': [4, 25]}|O O O B I O O O O O O O O O O B I I I I I I I I I I
36|@user @user @user @user You're a SKANK ... Leave our house and country . Take your corrupt parents with you . You're all cheap white trash ! ! !|{'start': [6, 16, 23], 'end': [6, 16, 25]}|O O O O O O B O O O O O O O O O B O O O O O O B I I O O O
37|@user you shouldn't be leaving your kitchen unattended #WomenSuck|{'start': [8], 'end': [8]}|O O O O O O O O B
38|@user CNN . U SHOULD B ASHAMED U ROTTEN DIRTY BITCH 4 MAKE FUN OF SOMEONES DISABILITY , U UGLY CUNT ! I hope someone breaks ur legs ! |{'start': [9, 19], 'end': [10, 20]}|O O O O O O O O O B I O O O O O O O O B I O O O O O O O O
39|love getting ass raped by pc kids on pubs when i am on console|{'start': [2], 'end': [3]}|O O B I O O O O O O O O O O
40|@user sup faggot suck my two inch cock thru my old navy jeans|{'start': [2], 'end': [7]}|O O B I I I I I O O O O O
41|"guy : "" i want a girl who's smart . but i also want a girl who is a total and complete slut whore . "" me : "" how bout a smart slutwhore ? "" "|{'start': [22, 33], 'end': [23, 33]}|O O O O O O O O O O O O O O O O O O O O O O B I O O O O O O O O O B O O
42|""" Welcome to America "" Illegal Immigration is A Crime Detain and Deport Illegal Alien #FamiliesBelongTogether in THEIR COUNTRY NOT THE U.S @user "|{'start': [5], 'end': [6]}|O O O O O B I O O O O O O O O O O O O O O O O
43|Cultural Diversity : The American Culture is fastly becoming the minority culture . But we are the only ones required to take cultural diversity training ? No one should be in America without having to learn American Culture . #BuildThatWall #ice #SCOTUS #TrumpRally|{'start': [39], 'end': [39]}|O O O O O O O O O O O O O O O O O O O O O O O O O O O O O O O O O O O O O O O B O O O
44|@user look at that nigger recording us|{'start': [4], 'end': [4]}|O O O O B O O
45|Only do much a man can take ! Fuckin bitch cunts !|{'start': [8], 'end': [10]}|O O O O O O O O B I I O
46|Whether you accept it or not, people are concerned with Islamic rape gangs and the spread of extremism.|{'start': [10], 'end': [17]}|O O O O O O O O O O B I I I I I I I
47|Muslims do not want to integrate, they want to impose sharia. And then they ask for respect! They are a problem!|{'start': [0, 9, 17], 'end': [5, 10, 20]}|B I I I I I O O O B I O O O O O O B I I I
48|@user well technically he was referring to a white bitch on go get it so ok|{'start': [8], 'end': [9]}|O O O O O O O O B I O O O O O O
49|ricky vaughn uses his anonymity to say the words nigger and faggot without repercussions and so many people on gab love it lol|{'start': [9], 'end': [11]}|O O O O O O O O O B I I O O O O O O O O O O O
50|"@user : If u ask me , every bitch gayor "" bi "" "|{'start': [8], 'end': [8]}|O O O O O O O O B O O O O
51|One of many Pakistani rapist.we should extradite them from our country.|{'start': [3, 6], 'end': [4, 7]}|O O O B I O B I O O O
52|( 1 ) @user < STFU These women put their babies in harms way & Subject them 2 rape & more by the coyotes who they pay 2 bring them here .|{'start': [5], 'end': [5]}|O O O O O B O O O O O O O O O O O O O O O O O O O O O O O O O O
53|yeah no feminism is kike mind poison inserted into the easily malleable female brain with the goal of undermining the white man|{'start': [4], 'end': [4]}|O O O O B O O O O O O O O O O O O O O O O O
54|following on from the other socialist tory pm the equally useless europhile traitor camoron theresa sharia may decides to try the hug a moslem suicide bomber approach|{'start': [23], 'end': [25]}|O O O O O O O O O O O O O O O O O O O O O O O B I I O
55|@user @user @user bitch if only you really wanted all the smoke like yall said yall did . stfu dumb ass hoe , you done said bye 15 ! times but wanna claim you not retarded , BYE BITCH |{'start': [3, 18, 38], 'end': [3, 21, 38]}|O O O B O O O O O O O O O O O O O O B I I I O O O O O O O O O O O O O O O O B
56|In the swimming pool there are baths only for Muslims, I cannot enter. If I, a white men, asked for something like this nobody would allow me. Muslims can do anything they want.|{'start': [6, 27], 'end': [9, 32]}|O O O O O O B I I I O O O O O O O O O O O O O O O O O B I I I I I
57|@user did not ching chong swat his friend or something|{'start': [3], 'end': [4]}|O O O B I O O O O O
58|@user Your a crack whore look in the mirror complete trash you are you make women yourself and the great s @url|{'start': [4], 'end': [4]}|O O O O B O O O O O O O O O O O O O O O O O
59|welp gave the negro too much credit because he currently ruining my bath by coming in here taking a shit|{'start': [3, 14], 'end': [3, 19]}|O O O B O O O O O O O O O O B I I I I I
60|the master bedroom curtisn at 10 crednhill park are wide open like a hooker three holes as clare is a slag slut tart whore slag slut like|{'start': [13, 20, 23], 'end': [13, 20, 25]}|O O O O O O O O O O O O O B O O O O O O B O O B I I O
61|Tonight is the Victoria's Secret fashion show .. Let the female tweets begin about how they wish their bodies were as good ! #WomenSuck|{'start': [23], 'end': [23]}|O O O O O O O O O O O O O O O O O O O O O O O B
62|niggas can be whoever they want to be in tweets got to remember that when you are online dating|{'start': [0], 'end': [0]}|B O O O O O O O O O O O O O O O O O O
63|these bitchass niggas bashing others for binge watching got should just fuck out of here ugot ayingowakulo bani|{'start': [1, 11], 'end': [2, 14]}|O B I O O O O O O O O B I I I O O O
64|There are really few Jews and millions of those bastards on the body of our country .|{'start': [4, 9], 'end': [4, 9]}|O O O O B O O O O B O O O O O O O
65|@user @user dawg at my last job all them white boys was married or was before n i always heard my fuckin whore ass wife dude|{'start': [21], 'end': [24]}|O O O O O O O O O O O O O O O O O O O O O B I I I O
66|I ' m not a nig and need a day off to smoke blunts and drink 40 ouncers .|{'start': [5], 'end': [5]}|O O O O O B O O O O O O O O O O O O O
67|It is incredible what we did in these years. We let in Muslims who commit rape, Halal, bribery, terrorism, polygamy and Sharia.|{'start': [9], 'end': [21]}|O O O O O O O O O B I I I I I I I I I I I I
68|#FAKENEWS @user lied to Anericans about Illegal Immigrants because Illegal Aliens Come First the #Democrats Platform #WalkAway #HappyBirthdayAmerica #Trump #MAGA #RedNationRising @user @user|{'start': [0, 6, 9], 'end': [0, 7, 10]}|B O O O O O B I O B I O O O O O O O O O O O O
69|The mental problem that terrorists have in common is Islam! Muslims are crazy!|{'start': [1], 'end': [12]}|O B I I I I I I I I I I I
70|"Here's a question for the Twitterverse What kind of an asshole calls himself an American but does NOTHING except defend illegal immigrant kids while he watches his fellow Americans getting killed by Criminaliens ? THIS KIND - REP TED "" Tedhead "" Lieu ( D-jo CA ) aka "" THE BCDOTUS "" @user "|{'start': [10, 20], 'end': [10, 21]}|O O O O O O O O O O B O O O O O O O O O B I O O O O O O O O O O O O O O O O O O O O O O O O O O O O O O O
71|A recent poll from yougov indicate that westeners do not consider Islam as good as other religions, and for this fact Islam is unsuitable with western values.|{'start': [21], 'end': [26]}|O O O O O O O O O O O O O O O O O O O O O B I I I I I
72|Teaching a woman to drive is like teaching a rock to swim . #WomenSuck|{'start': [13], 'end': [13]}|O O O O O O O O O O O O O B
73|cock slut what the hell is this|{'start': [0], 'end': [1]}|B I O O O O O
74|damn nigga chewbacca died lol|{'start': [1], 'end': [1]}|O B O O O
75|"The first sexual attack against a woman happened in Hungary . The criminal is a "" legal "" afghan rapefugee . This is how Orban protects us . "|{'start': [2, 18], 'end': [2, 19]}|O O B O O O O O O O O O O O O O O O B I O O O O O O O O
76|europe is being destroyed by the kike eu which is run by the crypto kike juncker to destroy whites|{'start': [6, 13, 14], 'end': [6, 14, 14]}|O O O O O O B O O O O O O B I O O O O
77|Remember , this the same bitch that was on FOX news saying rape culture was an attack on young men . Its her pussy be a @url|{'start': [5, 12, 23], 'end': [5, 12, 23]}|O O O O O B O O O O O O B O O O O O O O O O O B O O O
78|Islam purpose is only the conquest.|{'start': [0], 'end': [5]}|B I I I I I
79|@user given that he some of the globalists top some are kikescum and that the dictatorship ruling over americans is largely comprised of jewfilth perverts and criminals pace wikileaks and that the most powerful banking factions are mostly ratfaced yids|{'start': [11, 38], 'end': [11, 39]}|O O O O O O O O O O O B O O O O O O O O O O O O O O O O O O O O O O O O O O B I
80|It is more then sad , it is anti-American , twitter is censoring the good guys because paid off by the bad guys like Soros , jsut like the #FakeNews media @user @user #BuildTheWall #LockThemUp #EndDACA #BoycottNFL #BoycottNike enough already |{'start': [8, 33], 'end': [8, 34]}|O O O O O O O O B O O O O O O O O O O O O O O O O O O O O O O O O B I O O O O O
81|This is our 1st amendment right being abuse , this is USA , please Mr President stop the censorship by social media today @user @user #BuildTheWall #LockHerUp #BoycottNike #BoycottNFL #EndDACA now |{'start': [25, 26], 'end': [25, 26]}|O O O O O O O O O O O O O O O O O O O O O O O O O B I O O O O
82|ICE seeks illegal alien in Colorado fatal hit-and-run who bonded out of jail @url|{'start': [2], 'end': [3]}|O O B I O O O O O O O O O O
83|Your bitch a true thot had to let her go like a cool cop shoot u and put a hole in ur head like a juice box|{'start': [1], 'end': [1]}|O B O O O O O O O O O O O O O O O O O O O O O O O O O
84|Illegal Aliens Killed Two Search And Rescue Dogs In Texas wicked infernal barbarians have no place in society ! #BuildTheWallNow #DeportThemAll #NoAmnesty #NoDACA #NoMs|{'start': [0, 19], 'end': [1, 20]}|B I O O O O O O O O O O O O O O O O O B I O O O
85|How many guys have you given your number so they would call you maybe ? #Whore #WomenSuck|{'start': [15, 16], 'end': [15, 16]}|O O O O O O O O O O O O O O O B I
86|Remember Kate Steinle today.It is the third anniversary of her deathWe must not forget . #KateSteinle #IllegalAliens #OpenBorders #BuildThatWall #MondayMorning #ImmigrationReform #ImmigrationIsAWeapon|{'start': [16, 17, 18, 20, 21], 'end': [16, 17, 18, 20, 21]}|O O O O O O O O O O O O O O O O B I I O B I
87|@user @user i always wondered why weidner acted like a faggot|{'start': [10], 'end': [10]}|O O O O O O O O O O B
88|Okay ladies look , nose rings are hot . But nose studs look like boogers and make you look like a dick chugging skank #WomenSuck |{'start': [21, 24], 'end': [23, 24]}|O O O O O O O O O O O O O O O O O O O O O B I I I
89|@user I never will understand how not enforcing the laws and working with fellow city , county , state , and federal law enforcement agencies isnt the Normal way of doing business . And how illegal aliens are being turned loose is crazy . #BuildThatWa |{'start': [35, 44], 'end': [36, 44]}|O O O O O O O O O O O O O O O O O O O O O O O O O O O O O O O O O O O B I O O O O O O O B
90|Our government forgot about our Christianity? For long time we fought Muslims, putting an end to their brutality. And now we support them? How could we do such a thing? Soldiers must solve this problem, because this is the real conflict.|{'start': [9], 'end': [17]}|O O O O O O O O O B I I I I I I I I O O O O O O O O O O O O O O O O O O O O O O O
91|fuck you you fucking faggot degenerated kike parasite anti white c we are going to wipe you from the face of this earth you better pray there is not a war soon|{'start': [0, 3, 5], 'end': [1, 4, 7]}|B I O B I I I I O O O O O O O O O O O O O O O O O O O O O O O O
92|slap the bitch in the fave with them hoes|{'start': [0, 8], 'end': [2, 8]}|B I I O O O O O B
93|The world would be a better place without Muslims. They are only killing and raping our children.|{'start': [1, 12], 'end': [8, 16]}|O B I I I I I I I O O O B I I I I
94|iron fist is a nigger lover|{'start': [4], 'end': [5]}|O O O O B I
95|daniel boone was a man he was a big man but i was bigger so he ran like a nigger up a tree|{'start': [19], 'end': [19]}|O O O O O O O O O O O O O O O O O O O B O O O
96|@user @user @user lol no one is supporting bhikharistan except pro muslim countries like turkey malaysia no one gives a fuck about porkistan|{'start': [8, 16], 'end': [8, 22]}|O O O O O O O O B O O O O O O O B I I I I I I
97|@user @user Lily doesnt know the meaning of Loyal . Shes a hothead alcoholic , mad cuz Jr dismissed her , So she runnin to kiss Ryan Ass ! Bye Felicia , & take that skank ass Art thief that YOU hired Out the fuck as well ! |{'start': [27, 35, 44], 'end': [27, 36, 44]}|O O O O O O O O O O O O O O O O O O O O O O O O O O O B O O O O O O O B I O O O O O O O B O O O
98|"Self described "" radical feminist "" makes death threats against #GamerGate WOC for not doing / thinking as she was told ."|{'start': [3, 7], 'end': [4, 8]}|O O O B I O O B I O O O O O O O O O O O O O
99|I'd punch that cunt in the fuckin mouth . Idgaf if she's a woman @url|{'start': [3, 6], 'end': [3, 6]}|O O O B O O B O O O O O O O O
100|@user's dealer obviously delivers #mkr #whatdrugproblem|{'start': [4, 5], 'end': [4, 5]}|O O O O B I
101|@user must be a bitch to eat with the fabric getting in the way of the cake - hole|{'start': [4], 'end': [4]}|O O O O B O O O O O O O O O O O O O O
102|Islam is not a peaceful religion and does not produce the best of men. It denounces women and encourages crimes. Criminals are not all of a certain race or religion, but one race and religion produces criminals.|{'start': [0, 31], 'end': [19, 36]}|B I I I I I I I I I I I I I I I I I I I O O O O O O O O O O O B I I I I I
103|I am not going to be beat down by a dyke , fag , or coon . |{'start': [12, 15], 'end': [12, 15]}|O O O O O O O O O O O O B O O B O
104|i grew up an hour away from niggerdelphia wm penn would be appalled that the city of brotherly love has turned into a nigger shithole|{'start': [7, 23], 'end': [7, 24]}|O O O O O O O B O O O O O O O O O O O O O O O B I
105|We do not want to admit that islam isn't a religion, it is only a cult that support murder.|{'start': [15], 'end': [18]}|O O O O O O O O O O O O O O O B I I I
106|rip nehlen he may be married to a beaner and a christcuck but at least he aiming in the right direction|{'start': [8, 11], 'end': [8, 11]}|O O O O O O O O B O O B O O O O O O O O O
107|i doubt that filth fucking bolshevik kike said that|{'start': [3, 6], 'end': [4, 6]}|O O O B I O B O O
108|a feminist on the bbc just said the royal air force need to create a safe space for women to report unwanted sexual advances i think she will soon realize what real unwanted sexual advances are if a female pilot is ever shot down over a moslem country|{'start': [42], 'end': [47]}|O O O O O O O O O O O O O O O O O O O O O O O O O O O O O O O O O O O O O O O O O O B I I I I I
109|@user you do know the nigger family skit had white people in it chappelle used the word for a skit he not walking around calling everybody faggots my iq understands that much|{'start': [5, 26], 'end': [5, 26]}|O O O O O B O O O O O O O O O O O O O O O O O O O O B O O O O O
110|paul ryan is a nigger loving degenerate and he going to eat the curve and he going to take a leather shampoo courtesy of paul nehlen boot heel|{'start': [4], 'end': [6]}|O O O O B I I O O O O O O O O O O O O O O O O O O O O O
111|@user fuck you and die you fuckin lezzie nigger white hating cunt|{'start': [1, 6, 9], 'end': [4, 8, 11]}|O B I I I O B I I I I I
112|forever lean stripper pole bitch this nigger purple sprite|{'start': [2, 6], 'end': [4, 8]}|O O B I I O B I I
113|It ' ll be a welcome change to see a fellow WN from seeing hundreds of lefty bastards going to see RATM .|{'start': [11, 17], 'end': [11, 17]}|O O O O O O O O O O O B O O O O O B O O O O O
114|it all fun games until the prison sheboons beat her half to death for appropriating their race then it just fun|{'start': [7, 8], 'end': [7, 12]}|O O O O O O O B I I I I I O O O O O O O O
115|"@user @user say that shit to my face "" Bruh "" you a bitch for gettin in a man u dont know business . Handle yo own shit "|{'start': [13], 'end': [13]}|O O O O O O O O O O O O O B O O O O O O O O O O O O O O
116|did not you have to leave for work hours ago you shit tier kike lol tell your hooknosed bosses to send someone better before your shift ends|{'start': [11, 17], 'end': [13, 18]}|O O O O O O O O O O O B I I O O O B I O O O O O O O O
117|And I urge Mattis to reject the Dems demand . #BuildThatWall #BuildTheWallNow #BuildTheWall|{'start': [10, 11, 12], 'end': [10, 11, 12]}|O O O O O O O O O O B I I
118|23 . the reason that fucking skank ass cunt lied about me was to cover up her shaking my kid , and being in on fucking up lawsuit |{'start': [5, 25], 'end': [8, 25]}|O O O O O B I I I O O O O O O O O O O O O O O O O B O O
119|This is what the streets of the #uk will look like in 10 more years #Brexitnow #stopimmigration|{'start': [16], 'end': [16]}|O O O O O O O O O O O O O O O O B
120|@user you stupid woman ! #mkr|{'start': [5], 'end': [5]}|O O O O O B
121|I beside myself watching these in California A bunch of UNAmericans gathered together in order to spout off #bullshit #GTFO of our Country #Trash #batshitcrazy #UndocumentedIsCriminal #SendThemBack #AmericaFirst #BuildTheWall @user|{'start': [18, 28], 'end': [18, 28]}|O O O O O O O O O O O O O O O O O O B O O O O O O O O O B O
122|@user fuck you raghead|{'start': [1], 'end': [3]}|O B I I
123|We need to eliminate all of those elements from the white race .|{'start': [10], 'end': [10]}|O O O O O O O O O O B O O
124|99% of Muslims in the UK are unemployable and refuse to work.|{'start': [2, 7], 'end': [2, 11]}|O O B O O O O B I I I I
125|@user good one ricky wait till those diesel dykes get hold of her round little ass|{'start': [8, 14], 'end': [8, 15]}|O O O O O O O O B O O O O O B I
126|Bitch wtf u unfollow me for if u just gone twatch me and comment on what u THINK is about u hoe , play with ya pussy or sum not me . |{'start': [0, 26], 'end': [1, 26]}|B I O O O O O O O O O O O O O O O O O O O O O O O O B O O O O O
127|@user shut up bitch no one fucking likes you ! Suck start a shotgun worthless cunt|{'start': [1, 3, 6, 10, 15], 'end': [1, 3, 6, 10, 15]}|O B O B O O B O O O B O O O O B
