Id|sentence|span|bio
1773|i like how the jew is losing so its using a fat nigger to talk shit always remember nigger the jew slaved you not the white man filthy nigger|{'start': [11, 12, 14, 18, 27, 28], 'end': [12, 12, 15, 18, 28, 28]}|O O O O O O O O O O O B I O B I O O B O O O O O O O O B I
1774|I hope they all starve .|{'start': [4], 'end': [4]}|O O O O B O
1775|If islamics would oppose to child rapists that live in their community rather than make conferences about Islam, this religion would become certainly harmonious.|{'start': [1, 5], 'end': [1, 6]}|O B O O O B I O O O O O O O O O O O O O O O O O
1776|@user @user keep that same energy behind bars you stupid nigger|{'start': [10], 'end': [10]}|O O O O O O O O O O B
1777|imagine thinking you are not in a race war already all this anti white propaganda the media spits out everyday is not real goyim go tell this nigger @user ‍ says he should put a maga hat on|{'start': [23, 27], 'end': [23, 27]}|O O O O O O O O O O O O O O O O O O O O O O O B O O O B O O O O O O O O O O
1778|<number> week ban wot game chat ban for saying i want to throw your mother in an oven shitskin|{'start': [12], 'end': [18]}|O O O O O O O O O O O O B I I I I I I
1779|@user @user @user question is how would it be had the refugee never been in finland to have given birth to a murderer|{'start': [11, 19], 'end': [11, 22]}|O O O O O O O O O O O B O O O O O O O B I I I
1780|I think that Muslims are fraudolent, because they do not oppose to ISIS or saudi human rights violations.|{'start': [3], 'end': [17]}|O O O B I I I I I I I I I I I I I I
1781|London is invaded by Muslims. It is more Londinistan than London. #londonhasfallen.|{'start': [0, 8, 11], 'end': [4, 8, 11]}|B I I I I O O O B O O B
1782|@user How many women sucked dick to further their career ? ? ? I bet there are plenty .|{'start': [4], 'end': [5]}|O O O O B I O O O O O O O O O O O O O
1783|It made me sick looking at all the Blacks and Asians .|{'start': [8], 'end': [8]}|O O O O O O O O B O O O
1784|there are not enough police and fire personnel in all of great britain to put out the fires crucifying a muzzie would ignite|{'start': [18], 'end': [20]}|O O O O O O O O O O O O O O O O O O B I I O O
1785|"@user only one problem theres a "" no pussies allowed "" sorry @user ... "|{'start': [8], 'end': [8]}|O O O O O O O O B O O O O O
1786|The blacks in #California are typical niggers .|{'start': [1, 6], 'end': [1, 6]}|O B O O O O B O
1787|@user Pernicious insulting myths : women as hysterical snowflakes who think everything is harassment ; men as un @url|{'start': [8], 'end': [8]}|O O O O O O O O B O O O O O O O O O O
1788|@user @user i assume leaders of shithole countries excluded|{'start': [6], 'end': [6]}|O O O O O O B O O
1789|You ' re worried about affirmative action and liberals , that ' s your spot . |{'start': [8], 'end': [8]}|O O O O O O O O B O O O O O O O
1790|It has become unbearable and is seriously changing me as a person watching my country be decimated .|{'start': [16], 'end': [16]}|O O O O O O O O O O O O O O O O B O
1791|throw some weave on dat bitch just bought a pack of yak|{'start': [5], 'end': [5]}|O O O O O B O O O O O O
1792|There are bands of muslim rapists everywhere in telford, rotherham, rochdale, oxford, newcastle etc. It is awful!|{'start': [2], 'end': [5]}|O O B I I I O O O O O O O O O O O
1793|@user wow ! ! ! Are you comin back up here ? they some bitch niggas|{'start': [14], 'end': [15]}|O O O O O O O O O O O O O O B I
1794|saint sir adolf was the most lied about person in history for financial political and kike reasons alt right history lesson|{'start': [15], 'end': [18]}|O O O O O O O O O O O O O O O B I I I O O
1795|niggers should suck white dick them faggots|{'start': [0, 4], 'end': [0, 6]}|B O O O B I I
1796|@user #BuildTheWall #NoChainMigration / VisaLottery & NoAmnesty ! #CorruptDemsCannotWinWith Hard WorkingAmericans BecauseWe all #WalkAwayFrom Your #Lies ! #MAGA #NoDACA|{'start': [1, 13], 'end': [1, 13]}|O B O O O O O O O O O O O B O O O O O
1797|had to block all my rl friend bc of that stupid hoe @user|{'start': [10], 'end': [11]}|O O O O O O O O O O B I O
1798|"Time to wake up ! "" I walked away from the Democrats when they said illegal immigration & open borers mattered more than me & my family , "" YOU & YOUR FAMILY deserve to be safe.President Trump's highest duty is to keep America safe . #NoAmnesty #NoDACA #EVerify #BuildTheWall "|{'start': [15, 49], 'end': [16, 49]}|O O O O O O O O O O O O O O O B I O O O O O O O O O O O O O O O O O O O O O O O O O O O O O O O O B
1799|@user i cant believe you say you hate faggots many times a day and you say you hate fat people once on your private account and everyone comes for you|{'start': [7], 'end': [8]}|O O O O O O O B I O O O O O O O O O O O O O O O O O O O O O
1800|Retweet if you've ever been fucked over by a woman ... Who am I kidding ? Of course you have ! #WomenSuck|{'start': [5, 21], 'end': [5, 21]}|O O O O O B O O O O O O O O O O O O O O O B
1801|he talking about hoes be thinking cause i buy you shit and give you money they gone get the same treatment|{'start': [3, 10], 'end': [3, 10]}|O O O B O O O O O O B O O O O O O O O O O
1802|Isis bride supported Isis and now that Isis is defeated, she wants to pass on our side. She does not have any rights! Let her die!|{'start': [0, 23], 'end': [1, 25]}|B I O O O O O O O O O O O O O O O O O O O O O B I I
1803|@user He is 100 % accurate . Diversity is our greatest weakness . Unity is our strength . United we stand , divided we fall . #BuildTheWall #DeportThemAll #StopTheInvasion #AmericaFirst |{'start': [26, 27, 28], 'end': [26, 27, 28]}|O O O O O O O O O O O O O O O O O O O O O O O O O O B I I O
1804|No your not ! You are scroungers / soldiers coming to create a caliphate or create chaos . Go home , look after your girlfriends / wives / kids . All fighting age . The last thing you are , are refugees ! Bugger off ! Bye , bey , cheers ... @user |{'start': [6, 43], 'end': [6, 44]}|O O O O O O B O O O O O O O O O O O O O O O O O O O O O O O O O O O O O O O O O O O O B I O O O O O O O O
1805|@user How does a wretched ugly BITCH show joy at being a wretched bitch . Wilson crawl into ur hole & disappear|{'start': [2], 'end': [3]}|O O B I O O O O O O O O O O O O O O O O O O
1806|When you're both a couple of filthy whores @user|{'start': [6], 'end': [7]}|O O O O O O B I O
1807|I know my avenues like the seven agnostics both hot and fuckin rape laurens ass that bitch right der .|{'start': [11, 16], 'end': [12, 16]}|O O O O O O O O O O O B I O O O B O O O
1808|Ladies you need to realize something . You may have a boyfriend , but unless there's a ring , you're still fair game ;) #WomenSuck |{'start': [24], 'end': [24]}|O O O O O O O O O O O O O O O O O O O O O O O O B
1809|MN : SOMALI MUSLIM IMMIGRANTS Explain Why It's Acceptable To Kill Anyone Who Insults Mohammed [ VIDEO ] @user|{'start': [3], 'end': [4]}|O O O B I O O O O O O O O O O O O O O
1810|@user go to bed faggot|{'start': [4], 'end': [4]}|O O O O B
1811|listening to <number> right now and man these callers are morons in hillbilly voice what if we switched aj hinch with bill o brien would the texans do well good lord|{'start': [12], 'end': [13]}|O O O O O O O O O O O O B I O O O O O O O O O O O O O O O O O
1812|fucc wring with a nigga thinking another nigga post to hold their weight cuz they cool with em|{'start': [4, 7], 'end': [4, 7]}|O O O O B O O B O O O O O O O O O O
1813|#IllegalImmigration #SecureOurBorders #IllegalAliensYes they are protesting #Trump at a #GOP gathering in ... @user|{'start': [0, 1, 2], 'end': [0, 1, 2]}|B I I O O O O O O O O O O O
1814|nazi is a kike jew term invented by an inbred schizoid kike rat they were called national socialists some gorillion were not gassed but should have been the world would be a much better place|{'start': [0, 18], 'end': [12, 25]}|B I I I I I I I I I I I I O O O O O B I I I I I I I O O O O O O O O O
1815|If she dressed like a hoe in the cold she a real Whore|{'start': [5, 9], 'end': [6, 9]}|O O O O O B I O O B O O O
1816|the only kike here is you|{'start': [2], 'end': [2]}|O O B O O O
1817|i intensely dislike jews i am not going to link up with a filthy white hating nigger who also dislikes them just because he nods to the fuhrer|{'start': [16], 'end': [16]}|O O O O O O O O O O O O O O O O B O O O O O O O O O O O
1818|@user we decided last night that she's a ' prawn head ' , particularly in that red dress #mkr #kat|{'start': [9, 18], 'end': [10, 18]}|O O O O O O O O O B I O O O O O O O B O
1819|@user bitch i live in another country and you just live in mg's hole|{'start': [1], 'end': [1]}|O B O O O O O O O O O O O O
1820|In addition to the vast problems coming across our open border , 1 RARELY mentioned = drug resistant diseases . TB , superbugs or exotic diseases few Americans have a resistance to . #HouseGOP @user @user @user @user @user #BuildTheWall #BuildThatWall |{'start': [39], 'end': [40]}|O O O O O O O O O O O O O O O O O O O O O O O O O O O O O O O O O O O O O O O B I
1821|Well Kat ... that's what happens when you're a whore  #BlackInkCrewCHI Phor & Ryan ( after he f'd your bff ) yeah u a hoe|{'start': [9, 24], 'end': [9, 24]}|O O O O O O O O O B O O O O O O O O O O O O O O B
1822|and he also a nigger|{'start': [4], 'end': [4]}|O O O O B
1823|Prom is coming up boys , don't forget your compression shorts ! #WomenSuck |{'start': [12], 'end': [12]}|O O O O O O O O O O O O B
1824|@user Join us over on please Sir , let us get away from the censorship of the present Big Tech companies , help conservatives get rid of them for good @user @user #BuildTheWall #LockThemUp #BoycottNFL #BoycottNike #EndDACA now |{'start': [32], 'end': [32]}|O O O O O O O O O O O O O O O O O O O O O O O O O O O O O O O O B O O O O O
1825|Islamists / Moslems have mastered the corrupt art of playing the victim and blaming other cultures for the violent beliefs taught in their main books.|{'start': [0, 13], 'end': [11, 24]}|B I I I I I I I I I I I O B I I I I I I I I I I I
1826|@user And how many #AmericanKids have yet to be reunited with their parents because their parents commit a CRIME ? Oh , that's right , #KamalaHarris doesn't care about #American kids , just #Illegals . #IllegalAliens #FamilySeparation #IllegalImmigrants |{'start': [33, 35, 37], 'end': [33, 35, 37]}|O O O O O O O O O O O O O O O O O O O O O O O O O O O O O O O O O B O B O B
1827|if the refugees say they are children arrest the libtard swede women for statutory rape either a moslem goes down or a libtard swede does someone has to go i wish both|{'start': [9], 'end': [23]}|O O O O O O O O O B I I I I I I I I I I I I I I O O O O O O O O
1828|U nothing but another pussy hole bitch get used to it|{'start': [4], 'end': [6]}|O O O O B I I O O O O
1829|if u freinds wit a jew or nigger den u ain t no freind of mine|{'start': [7], 'end': [7]}|O O O O O O O B O O O O O O O O
1830|This gay kill a young bulgarian man to protect some criminal brown gypsy from beating This is the true face of so-called ` ` anti-racist ' ' !|{'start': [1, 5, 11, 24], 'end': [1, 5, 12, 24]}|O B O O O B O O O O O B I O O O O O O O O O O O B O O O
1831|I don't have to tell my homies not to take women cus they don't want us we just move on to the next bitch|{'start': [6, 23], 'end': [6, 23]}|O O O O O O B O O O O O O O O O O O O O O O O B
1832|Nevermind , found the new page Knew it had to be a groid ... any report of rape ? |{'start': [12, 17], 'end': [12, 17]}|O O O O O O O O O O O O B O O O O B O
1833|Go on talking to yourself, no one will listen. Islam does not belong within western society. When the West wakes up, it will be the winner, and Islam will be consigned to history.|{'start': [9, 27], 'end': [15, 30]}|O O O O O O O O O B I I I I I I O O O O O O O O O O O B I I I O O
1834|I will respond until Armenian scum will stop|{'start': [5], 'end': [5]}|O O O O O B O O
1835|Bitch dont come to me as a woman ... Cuz yo nigga came at me single|{'start': [0, 11], 'end': [0, 11]}|B O O O O O O O O O O B O O O O
1836|Since 2000 all suicide bombings were committed by a Muslim and no one handle this fact that about global terrorism.|{'start': [3, 9], 'end': [4, 9]}|O O O B I O O O O B O O O O O O O O O O
1837|Now we are not even allowed to walk the dog for fear of offending the local Muslim population.|{'start': [11], 'end': [17]}|O O O O O O O O O O O B I I I I I I
1838|. @user has either taken to some seriously ham fisted trolling or shes on meth / out of meth which I have suspected about her|{'start': [8, 14], 'end': [10, 18]}|O O O O O O O O B I I O O O B I I I I O O O O O O
1839|. @user Real question is do feminist liberal bigots understand that different rules for men / women is sexism @user|{'start': [6, 18], 'end': [8, 18]}|O O O O O O B I I O O O O O O O O O B O
1840|ILLEGAL ALIEN SCAM ALERT ! Deport Illegals with their kids dont allow them to drop off their kids like Road Kill at the Border ! U.S Taxpayers not their babysitters what happen to #FamiliesBelongTogether ? #Immigration #RedNationRising #Trump #MAGA @user|{'start': [0, 5], 'end': [1, 6]}|B I O O O B I O O O O O O O O O O O O O O O O O O O O O O O O O O O O O O O O O
1841|that nigga rob said drums over flats and a proud bleu cheese advocate and you all let that boy talk crazy bout food to you all smh|{'start': [1], 'end': [1]}|O B O O O O O O O O O O O O O O O O O O O O O O O O O
1842|another nigger lover bites the dust|{'start': [1], 'end': [2]}|O B I O O O
1843|Let mother nature evolve these people naturally because no amount of money or aid is going to drag these ' things ' into the civilized world where they serve absolutely no purpose .|{'start': [20], 'end': [20]}|O O O O O O O O O O O O O O O O O O O O B O O O O O O O O O O O O
1844|After Libs Help Them Avoid Audit , California DMV Finds 23,000 Bad Voter Registrations #IllegalAliens #BuildTheWall #NoDACA #NoAmnasty #UnderminesOurDemocracy #VoteRedToSaveAmerica |{'start': [14, 15], 'end': [14, 15]}|O O O O O O O O O O O O O O B I O O O O
1845|LOL GJ brother 10 points for the Uber humans and - 10 for the sub human ape creatures you are truly one bad mofo whitey crakker man|{'start': [16, 24], 'end': [16, 24]}|O O O O O O O O O O O O O O O O B O O O O O O O B O O
1846|anyway princess sapphire of silverland is a dyke and threw the first brick at stonewall|{'start': [7], 'end': [7]}|O O O O O O O B O O O O O O O
1847|started as trash ending as worthless nigger trash|{'start': [5], 'end': [7]}|O O O O O B I I
1848|@user Or you were just being a hoe and hurt it slut droppin on ya girl at the club xx|{'start': [7, 11], 'end': [7, 11]}|O O O O O O O B O O O B O O O O O O O O
1849|@user Illegals can reunite back across the border in Mexico ! We dont need the extra crime that the illegal or refugees invaders bring to America . #NoDACA #NoVisaLottery #NoBenefits4Illegals #NoChainMigration #BuildTheWall #E-Verify @user|{'start': [0, 16, 19, 21, 28, 29, 30, 31], 'end': [0, 16, 19, 22, 28, 29, 30, 31]}|B O O O O O O O O O O O O O O O B O O B O B I O O O O O B I I I O O
1850|Don't you hate how girls just Whore around because they never got daddy's attention ? ? And so they have to interfere in relationships .. hoe|{'start': [6, 25], 'end': [6, 25]}|O O O O O O B O O O O O O O O O O O O O O O O O O B
1851|Stu a rape faced faggot man I'm sick of this nigga .|{'start': [0, 2, 10], 'end': [0, 2, 10]}|B O B O O O O O O O B O
1852|@user slack jawed knuckle dragging mouth breathing toothless inbred redneck backwoods uneducated hillbilly hicks that the republican party|{'start': [1], 'end': [13]}|O B I I I I I I I I I I I I O O O O
1853|Watching those videos makes me feel like im going to explode with hatred for those creatures .|{'start': [12], 'end': [12]}|O O O O O O O O O O O O B O O O O
1854|type of nigga to fight the doctor|{'start': [2], 'end': [2]}|O O B O O O O
1855|@user your 2 . And 3 . Nigga them hoes suck wayans brothers are not funny at all Jamie foxx should be number 2|{'start': [7, 9], 'end': [7, 10]}|O O O O O O O B O B I O O O O O O O O O O O O O
1856|that white bitch from clueless is fine|{'start': [1], 'end': [2]}|O B I O O O O
1857|@user @user This old bitch needs to go out to pasture ! Dig a hole too racist|{'start': [4, 16], 'end': [4, 16]}|O O O O B O O O O O O O O O O O B
1858|stunting on all yall hoes that was flexing on me|{'start': [4], 'end': [4]}|O O O O B O O O O O
1859|American Citizens are being Victimized by Illegal AliensThe shocking findings by a new DOJ-DHS report . @user #NoDACA #NOAmnesty #NoSanctuary #EndChainMigration #DeportThemAll #HonorYourOath #ProtectUSA #KeepAmericansSafeIt is your JOB !|{'start': [6, 21], 'end': [7, 21]}|O O O O O O B I O O O O O O O O O O O O O B O O O O O O O
1860|@user Aww y u so mad tho , a successful man LMFAO , hut hugging as faggot . |{'start': [16], 'end': [16]}|O O O O O O O O O O O O O O O O B O
1861|Why do women use them being on their period as a excuse to be a cunt ? You had it since you were 13 you canâ control yourself ?|{'start': [15], 'end': [15]}|O O O O O O O O O O O O O O O B O O O O O O O O O O O O O
1862|All versions of Islam have sharia law, thus, they are all extreme. Not all Muslims are engaged in actual violences, but every Muslim knows that jihad is the core of their religion, and they all support it.|{'start': [3, 5, 25], 'end': [3, 6, 25]}|O O O B O B I O O O O O O O O O O O O O O O O O O B O O O O O O O O O O O
1863|The American people also agree ! Illegal aliens do not deserve a free pass ahead of hard working people , trying to come to our country legally . #BuildTheWall #DeportIllegals #GaysForTrump #NoDACA |{'start': [6, 28, 29, 30], 'end': [7, 28, 29, 30]}|O O O O O O B I O O O O O O O O O O O O O O O O O O O O B I I O
1864|I just want to knock @user's cocky face out #mkr|{'start': [6, 9], 'end': [7, 9]}|O O O O O O B I O B
1865|#ExposeTerroristTrainingCamps #ShutDownTerroristTrainingCamps #ShutDownInvasionOfIllegalAliens #BuildTheWall #EndChainMigration #EndVisaLottery IN OTHER WORDS START PROTECTING AMERICAN CITIZENS ! ! ! @user @user @user @user @user @user @user|{'start': [0, 1, 2, 3, 4, 5], 'end': [0, 1, 2, 3, 4, 5]}|B I I I I I O O O O O O O O O O O O O O O O O
1866|@user fuck Brett Farve redneck ass , he stuckup he don't give a damn lol he be on campus acting like he the shit |{'start': [5, 23], 'end': [5, 23]}|O O O O O B O O O O O O O O O O O O O O O O O B
1867|@user Passenger from Harlingen to Dallas , TX has infected many to measles ! ! ! Stop the invasion . #BuildThatWall #KAG |{'start': [20], 'end': [20]}|O O O O O O O O O O O O O O O O O O O O B O
1868|Ask any liberal how many illegal aliens they've let stay in their house . The answer probably won't surprise you . #SendThemBack #BuildTheWall @user|{'start': [5, 21], 'end': [6, 22]}|O O O O O B I O O O O O O O O O O O O O O B I O
1869|while leftie morons suck fascist moslem cock oh the irony of such hypocrites|{'start': [0], 'end': [6]}|B I I I I I I O O O O O O
1870|Criminal Illegal Alien Accused of Sexually Assaulting Eight-Year-Old Florida Girl #DrawAndQuarter #ImmigrationMoratorium #EndTheBirthrightScam #DeportThemAll #NoDACA #FundTheWholeWall #TripleWall #NationalCastleDoctrine via @user|{'start': [1, 12, 13, 15, 16], 'end': [2, 12, 13, 15, 16]}|O B I O O O O O O O O O B I O B I O O O
1871|Video of woman getting slapped by RAPEFUGEE in DHIMMI Paris sparks outrage @url|{'start': [4], 'end': [4]}|O O O O B O O O O O O O O
1872|@user : @user shut the fuck up , you fucking trash nigga , work on another ring @url|{'start': [3, 5, 9, 11], 'end': [3, 5, 9, 11]}|O O O B O B O O O B O B O O O O O O
1873|I would ' nt even consider these knackers / pykies as Irish as they have no respect for their race or loyalty to Ireland and should be put down like the dogs they are .|{'start': [7, 9, 19, 31], 'end': [7, 9, 19, 31]}|O O O O O O O B O B O O O O O O O O O B O O O O O O O O O O O B O O O
1874|@user lets see what they will do to the smelly kike who composed that tweet and whose name is visible in the photo the world awaits his lynching with relish|{'start': [9, 27], 'end': [10, 29]}|O O O O O O O O O B I O O O O O O O O O O O O O O O O B I I
1875|@user want women to have equal rights unless you donâ  fit my exact definition of how a woman should be then you are a hoe|{'start': [24], 'end': [24]}|O O O O O O O O O O O O O O O O O O O O O O O O B
1876|France has been gone for a long time , we will have to retake it later because there will be no French people in not too long . |{'start': [21], 'end': [21]}|O O O O O O O O O O O O O O O O O O O O O B O O O O O O
1877|A raped girl says rapists recited Quran to her to justify their crimes.|{'start': [0], 'end': [12]}|B I I I I I I I I I I I I
1878|"@user @user Still can't be . Even the neonazis behind the "" rapefugee "" website only claim around 450 rapes by immigrants for all of 2016 (8 00 % more than suspected ( ! ) rapes officially recorded ) . So if we pretend for a moment those numbers are "|{'start': [12, 19], 'end': [12, 19]}|O O O O O O O O O O O O B O O O O O O B O O O O O O O O O O O O O O O O O O O O O O O O O O O O O O
1879|Mom - Katie why would you send this kind of picture to daddy Katie - that's not dad , mom Mom - you dirty little whore @url|{'start': [23], 'end': [25]}|O O O O O O O O O O O O O O O O O O O O O O O B I I O
1880|it is impossible for me to follow the rules on twitter you can not even call girls who shave the sides of their heads ugly dykes anymore|{'start': [24], 'end': [25]}|O O O O O O O O O O O O O O O O O O O O O O O O B I O
1881|@user @user Good English you dumb cunt slober on my nob u Jew if you were playing I would fucking rape you cunt|{'start': [5, 12, 19, 22], 'end': [7, 12, 20, 22]}|O O O O O B I I O O O O B O O O O O O B I O B
1882|@user As long as it takes to #BuildThatWall|{'start': [7], 'end': [7]}|O O O O O O O B
1883|how free speech not a thing anymore just because it online i can not say cunt your a cunt twitter|{'start': [15, 18], 'end': [15, 18]}|O O O O O O O O O O O O O O O B O O B O
1884|Excellent.Since we can't separate families , lock all their asses up until a judge can deport them . I'm all in.Thank you @user #MAGA #nosanctuarybrewster #BuildTheWall #NoDACA |{'start': [9, 25], 'end': [9, 25]}|O O O O O O O O O B O O O O O O O O O O O O O O O B O
1885|more worried about your skank ass girlfriend than your own kids i see your true priorities|{'start': [4], 'end': [5]}|O O O O B I O O O O O O O O O O
1886|Labour party counts upon the votes of Britain Muslims, that is why they do not deal with disgusting antisemitism from their side! It is a question of math, that is all.|{'start': [7, 17], 'end': [8, 18]}|O O O O O O O B I O O O O O O O O B I O O O O O O O O O O O O
1887|paul joseph watson thinks he looks cool with a ciggie hanging out of his big nigger lips|{'start': [15], 'end': [15]}|O O O O O O O O O O O O O O O B O
1888|brown fuck with us dick no fuckin this nigger|{'start': [0], 'end': [8]}|B I I I I I I I I
1889|Putting women on pedestals , Gen Kelly , is why women are abused . We don't fall neatly into the madonna / whore categories . We're people FFS . |{'start': [12, 22], 'end': [12, 22]}|O O O O O O O O O O O O B O O O O O O O O O B O O O O O O
1890|@user You know whats insane Dana ! ! Is how the NRA continues to get away with fucking murdering children in country ! Why dont you shut the fuck up greedy skank ! !|{'start': [17, 28], 'end': [17, 31]}|O O O O O O O O O O O O O O O O O B O O O O O O O O O O B I I I O O
1891|Using violence to punish another person? Sounds like a muslim issue.|{'start': [1, 9], 'end': [3, 10]}|O B I I O O O O O B I
1892|Yes Brooke ! Give that bitch the hell she deserves . I knew it would take her to slap that skank down . #BoldandBeautiful|{'start': [5, 20], 'end': [5, 20]}|O O O O O B O O O O O O O O O O O O O O B O O O
1893|If we do not stand up against Islam they will consider our silence as a way of acceptance!|{'start': [4], 'end': [7]}|O O O O B I I I O O O O O O O O O O
1894|get the honky cat|{'start': [2], 'end': [2]}|O O B O
1895|i saw a couple baums and steins in the victim list but that about it ya got more info i thought the school was half spic though|{'start': [3, 24], 'end': [6, 25]}|O O O B I I I O O O O O O O O O O O O O O O O O B I O
1896|This is the goals of Islam when Muslims settle in a country: build a mosque, form a community, obtain victims, get support from the politicals, take advantage of laws, impose Sharia, conquer the country.|{'start': [3, 18, 29], 'end': [5, 19, 33]}|O O O B I I O O O O O O O O O O O O B I O O O O O O O O O B I I I I
1897|Islam does not help science progression, because it does not have useful elements and it isn't rational.|{'start': [0], 'end': [5]}|B I I I I I O O O O O O O O O O O
1898|grown ass men doing women activities and lil faggot boys taking your daughter homecoming queen crown this what the fuck yall wanted|{'start': [0, 7, 19], 'end': [2, 9, 19]}|B I I O O O O B I I O O O O O O O O O B O O
1899|I hate to see such beautiful white females become victims of these sick , violent merciless animals . |{'start': [6, 12], 'end': [6, 15]}|O O O O O O B O O O O O B I I I O O
1900|Surely THIS proves that those two cunts can't cook #mkr|{'start': [5, 9], 'end': [6, 9]}|O O O O O B I O O B
1901|A big sour whore bag , should never play hard to get when all she's does is fling up da pussy in all kind of styles to all kinds of men #fact |{'start': [3, 20], 'end': [3, 20]}|O O O B O O O O O O O O O O O O O O O O B O O O O O O O O O O O
1902|Two alleged MS - 13 gang members , who are ILLEGAL ALIENS charged with kidnapping and murders of two Houston teenagers age 14 and 16 years-old . #BuildThatWall #ImmigrationReform #NoChainMigration |{'start': [10, 27], 'end': [11, 27]}|O O O O O O O O O O B I O O O O O O O O O O O O O O O B O O
