Id|sentence|span|bio
621|Absolutely perfect keep the whole lot of Illegal Aliens out , now maybe libtarded snowflakes will be happy they are not being split up ? #maga #kag #nodaca #noamnesty #BuildThatWall #BuildTheWallNow #BuildTheDamnWall #BuildTheWall |{'start': [7, 29, 30, 31, 32], 'end': [8, 29, 30, 31, 32]}|O O O O O O O B I O O O O O O O O O O O O O O O O O O O O B I I I
622|white washed asians are so stuck up and rude fuck you ching chong china lady|{'start': [9], 'end': [14]}|O O O O O O O O O B I I I I I
623|Im so sick of this hoe speaking on me bitch you dont know SHIT STFU|{'start': [5, 9, 13], 'end': [5, 9, 14]}|O O O O O B O O O B O O O B I
624|damn i d eat this girl up but girls be fake gay that the worst|{'start': [7], 'end': [11]}|O O O O O O O B I I I I O O O
625|To the minister: start counteracting terror and crisis caused by Islam! Stop burying your heads in sand.|{'start': [3], 'end': [10]}|O O O B I I I I I I I O O O O O O
626|#IllegalAliens are robbing #Americans of retirement who do you think pays for their healthcare and emergency room visits my #ObamaCare costs me $ 36,000 per year because of them @user @user @user @user @user @user #BuildThatWall |{'start': [0, 35], 'end': [0, 35]}|B O O O O O O O O O O O O O O O O O O O O O O O O O O O O O O O O O O B
627|I cannot stand girls that ALWAYS have to have a boyfriend . #AttentionWhores #WomenSuck|{'start': [12, 13], 'end': [12, 13]}|O O O O O O O O O O O O B I
628|#Immigration #IllegalAliens #BorderSecurity #BorderPatrol #MigrantsHow noble of #JohnLegend to stand up against the evil #Republicans ... @user|{'start': [0], 'end': [2]}|B I I O O O O O O O O O O O O O O
629|The only purpose of Islam is to dominate and destroy us! Being multicultural has nothing to do with it.|{'start': [2], 'end': [10]}|O O B I I I I I I I I O O O O O O O O
630|people with talent something you paki street shitters lack|{'start': [5], 'end': [7]}|O O O O O B I I O
631|No white person should send a single penny or lift a single finger to help them .|{'start': [1], 'end': [1]}|O B O O O O O O O O O O O O O O O
632|Stop race mixing and discourage those who practice it .|{'start': [5], 'end': [5]}|O O O O O B O O O O
633|@user @user @user We don't want our countries to be over run with rapefugee parasite Moslem scum . You already have 57 countries , stay in those countries . Those countries suck because they are full of your type . #StopIslam #BanSh |{'start': [13, 40], 'end': [16, 40]}|O O O O O O O O O O O O O B I I I O O O O O O O O O O O O O O O O O O O O O O O B O
634|fuck you all dykes|{'start': [0, 3], 'end': [1, 3]}|B I O B
635|how about donating flights to deport the Invaders back to their homeland . #StopTheInvasion #DeportThemAll @url|{'start': [5, 14], 'end': [5, 14]}|O O O O O B O O O O O O O O B O
636|@user Lmfao shut the fuck up with your Brentwood Academy havin ass . Yall have one of the worst QBs in the league as far as TD / INT ratio go but you hate on every other quarterback ... Sit your pussy ass down and get swept by the Titans again .|{'start': [2, 11, 41], 'end': [5, 11, 42]}|O O B I I I O O O O O B O O O O O O O O O O O O O O O O O O O O O O O O O O O O O B I O O O O O O O O O
637|you re not going to tell me to say happy birthday to someone that called me a cunt and a slut within the span of 10 minutes|{'start': [17, 22], 'end': [17, 22]}|O O O O O O O O O O O O O O O O O B O O O O B O O O O
638|@user @user @user Says the supporter of a woman .. @user ... that literally protected & threw every woman under the bus that accused her President husband of rape , affairs , etc . Pleeeeeease , STFU , or educate yourself . |{'start': [28, 36], 'end': [28, 36]}|O O O O O O O O O O O O O O O O O O O O O O O O O O O O B O O O O O O O B O O O O O
639|oh i fucking hate you cuz you a fucking time wasting motherfucker|{'start': [2, 8], 'end': [3, 11]}|O O B I O O O O B I I I
640|The Sunnan Abu Dawud says that if a man has sex with an animal there will be no punishment.|{'start': [0], 'end': [18]}|B I I I I I I I I I I I I I I I I I I
641|If ya bitch ass didnt wish me a happy Birthday then dont ever hit me up again ! You are trash ! Yes I am talking about you hoe !|{'start': [2, 28], 'end': [3, 28]}|O O B I O O O O O O O O O O O O O O O O O O O O O O O O B O
642|Muslims are two-faced, have you ever seen a Muslim protest against Isis or Saudi human right abuses?|{'start': [0, 8], 'end': [2, 16]}|B I I O O O O O B I I I I I I I I
643|him idc what she says i will grab any woman by the pussy and fuck you brownies and fuck you fags and dykes us he a rapist racist homophobe transphobe you all how can you be so unpatriotic can t you see he is bringing america back to her roots us yup he sure is|{'start': [5, 37], 'end': [29, 37]}|O O O O O B I I I I I I I I I I I I I I I I I I I I I I I I O O O O O O O B O O O O O O O O O O O O O O O O O
644|@user @user @user evidence this with links and articles show me a greater number of violated females by white men than mass murdered genocides of females at the hands of muslims muslim men have killed far more females with their misogyny and genocides than white men|{'start': [15, 21], 'end': [16, 45]}|O O O O O O O O O O O O O O O B I O O O O B I I I I I I I I I I I I I I I I I I I I I I I I
645|This white bitch had the fuckin nerve to call me a nigga 👎 when shes the one payin for her lips to get bigga 😂 😴|{'start': [1, 5, 11], 'end': [2, 5, 11]}|O B I O O B O O O O O B O O O O O O O O O O O O O O
646|Muslims have nothing to contribute to our society.|{'start': [0], 'end': [4]}|B I I I I O O O
647|all high level bolsheviks were somewhat kosher the only russians involved were low level muscle golden rule if a kike says it it will almost always be a lie|{'start': [19], 'end': [19]}|O O O O O O O O O O O O O O O O O O O B O O O O O O O O O
648|Cunt drowns Children because she's .. A CUNT ! Woman who feared deportation drowns baby and 5 - year - old @url|{'start': [0, 7, 12], 'end': [0, 7, 12]}|B O O O O O O B O O O O B O O O O O O O O O
649|Women ... Can't live with them ... Can't shoot them .|{'start': [8], 'end': [8]}|O O O O O O O O B O O
650|can grown women stop glorifying being a hoe , y'all don't realize the influence on the young bitches |{'start': [7, 17], 'end': [7, 17]}|O O O O O O O B O O O O O O O O O B
651|I think @user has done a pretty good job of humiliating herself already #mkr|{'start': [10, 13], 'end': [11, 13]}|O O O O O O O O O O B I O B
652|#Democrats Illegal Alien Grand Ma Caught Sneakin in 31 Pounds of Herion from Mexico Proving Illegal Grand Mas Must be deported too ! #Trump #MAGA #RedNationRising Abolish Illegals Keep @user @user #Immigration|{'start': [0, 1, 2, 27, 31], 'end': [0, 1, 2, 27, 31]}|B I I O O O O O O O O O O O O O O O O O O O O O O O O B O O O B
653|fuck the nigger bitches|{'start': [0], 'end': [3]}|B I I I
654|If I could create a disease that wipes out all Black ' s I would .|{'start': [10], 'end': [10]}|O O O O O O O O O O B O O O O O
655|open a new shop somewhere get my son more interested in education ( he hates school ) help mor ein my community try to whiten things up > >|{'start': [14], 'end': [14]}|O O O O O O O O O O O O O O B O O O O O O O O O O O O O O
656|@user well fuck you too hoe|{'start': [2, 5], 'end': [2, 5]}|O O B O O B
657|I considered it being ` ` ethnically cleansed ' ' from my childhood home|{'start': [6], 'end': [6]}|O O O O O O B O O O O O O O
658|@user oh but they do . Then they go around and bitch how all women are stupid golddiggers because they went to @url|{'start': [11, 17], 'end': [11, 17]}|O O O O O O O O O O O B O O O O O B O O O O O
659|I am displeased w what this bitch said about what rape is . @user @user|{'start': [6, 10], 'end': [6, 10]}|O O O O O O B O O O B O O O O
660|sadiq khan a nasty paki muslim said this is part and parcel of life in london and wants all non muslims out of london so he can bring in million more muslims fucked up mps are all for it know thy enemy|{'start': [4, 32], 'end': [4, 33]}|O O O O B O O O O O O O O O O O O O O O O O O O O O O O O O O O B I O O O O O O O O
661|We can turn the cold useless parts of Canada into a dumping ground for Jews and arm the Indians to keep them in line .|{'start': [14], 'end': [14]}|O O O O O O O O O O O O O O B O O O O O O O O O O
662|November 6 IS CLOSE #VoteRed if you support & grieve for victims such as Kate Steinle & Mollie TibbettsVote Dem if you support the illegal aliens who killed them in cold blood #POTUS #MAGA #KAG #GetOutTheVote #RedWave #BuildTheWall #NoDACA #AmericaFirst #ICE #Trump|{'start': [24, 31, 37], 'end': [25, 31, 37]}|O O O O O O O O O O O O O O O O O O O O O O O O B I O O O O O B O O O O O B O O O O
663|mane fuck you all kike|{'start': [1, 4], 'end': [2, 4]}|O B I O B
664|Let me show and prove it what these hoes aint doing , let a real bitch do it|{'start': [8, 15], 'end': [8, 15]}|O O O O O O O O B O O O O O O B O O
665|@user Fake News it is not a new Stephen Miller Rule . the Public Charge rule has been part of the U.S #Immigration law since 1882 . Why Should U.S Taxpayers give Welfare to Immigrants and import the World's poor ! #Veterans #Trump #MAGA @user|{'start': [38], 'end': [38]}|O O O O O O O O O O O O O O O O O O O O O O O O O O O O O O O O O O O O O O B O O O O O O
666|Get rid of @user #VoteRed - #BuildTheWall from the Pacific Ocean to the Gulf of Mexico - #NoDACA #NoAmnesty #Deport all illeagles and their families - #ProudAmerican #AmericaFirst #MAGA #KAG|{'start': [6, 19, 21], 'end': [6, 19, 21]}|O O O O O O B O O O O O O O O O O O O B O B O O O O O O O O
667|@user hell naw fuck them bitches serves them right|{'start': [3, 5], 'end': [3, 5]}|O O O B O B O O O
668|Two days ago I tapped out a half asian , half White mongrel who was bigger than me . |{'start': [8, 11], 'end': [8, 12]}|O O O O O O O O B O O B I O O O O O O
669|HAINES CITY , Fla Wilibaldo Garcia an Illegal Alien from Mexico charged with sexual battery on an 8 yr old girl.Garcia has an alias Lorenzo Sipriano with prior criminal history . #MSMSilence #BuildThatWall |{'start': [7, 32], 'end': [8, 32]}|O O O O O O O B I O O O O O O O O O O O O O O O O O O O O O O O B
670|#BuildTheWallNow Before the Midterm elections @user @user @user @user #MAGA #MakeDCListen #NoAmnesty #NoDACAdeal #MandateEverify #EndChainMigration|{'start': [0], 'end': [0]}|B O O O O O O O O O O O O O O
671|Bitch stfu ? I didnt asked you something , dumbass hoe ? And obsessed ? Shut you dirty ass , cause we all know esme was so obsessed with me that she keeped subtweeting about me LOOOOOOOOL |{'start': [0, 9, 15], 'end': [1, 10, 18]}|B I O O O O O O O B I O O O O B I I I O O O O O O O O O O O O O O O O O O
672|just seen somebody eating a honeybun with cheese on it im getting real tired of you niggers|{'start': [16], 'end': [16]}|O O O O O O O O O O O O O O O O B
673|this lil yid pig should be sued by the million he fucked over with their info and strip him clean of every penny and life in prison dirty lil fuckin snyde rat and i am being nice|{'start': [2, 10, 29], 'end': [3, 12, 31]}|O O B I O O O O O O B I I O O O O O O O O O O O O O O O O B I I O O O O O
674|﻿ Hurray , saving us $ $ $ in so many ways @user @user #LockThemUp #BuildTheWall #EndDACA #BoycottNFL #BoycottNike |{'start': [14, 15], 'end': [14, 15]}|O O O O O O O O O O O O O O B I O O O
675|There should not be problems between the different classes inside the race white since we are all whites they should be joined to fight against non-whites they are our enemies .|{'start': [11, 17, 25], 'end': [12, 17, 25]}|O O O O O O O O O O O B I O O O O B O O O O O O O B O O O O O
676|that was just a photo look up rhyan moody she was killed on thanksgiving by an illegal spic|{'start': [11], 'end': [17]}|O O O O O O O O O O O B I I I I I I
677|excited for dam with bitches|{'start': [2], 'end': [4]}|O O B I I
678|smallest amount in the kike bowl|{'start': [4], 'end': [4]}|O O O O B O
679|sorry mate my comment was more so aimed at the self professed kike killer|{'start': [12], 'end': [13]}|O O O O O O O O O O O O B I
680|lmao the vikings suck get these niggas out of our city|{'start': [2, 4], 'end': [3, 7]}|O O B I I I I I O O O
681|Our western civilisation risks to be destroyed by islam.|{'start': [6], 'end': [8]}|O O O O O O B I I
682|We have fear about rapes made by Muslim gangs and the diffusion of extremism, it is difficult to accept this fact but we are really in this situation.|{'start': [2], 'end': [13]}|O O B I I I I I I I I I I I O O O O O O O O O O O O O O
683|In recent times was made a survey that says that a large part of britons believe that there is a 'fundamental conflict' between Islam and 'british traditions'.|{'start': [20], 'end': [26]}|O O O O O O O O O O O O O O O O O O O O B I I I I I I
684|@user To the whore who runs your shitshow . Go educate yourself as to why acting like a fucking political slut doesn't @url|{'start': [7, 18], 'end': [7, 20]}|O O O O O O O B O O O O O O O O O O B I I O O
685|@user some shit skin|{'start': [2], 'end': [3]}|O O B I
686|"Since the feminists at #sorryitsaboy & #everydaysexism NOW just LOVE "" jokes "" I thought they'd like this oneright ?"|{'start': [2, 4, 6], 'end': [2, 4, 6]}|O O B O B O B O O O O O O O O O O O O O
687|Europe is civilised, Muslims should not stay there.|{'start': [3], 'end': [7]}|O O O B I I I I
688|niggerchomp isnt a chink she a white american dog|{'start': [0], 'end': [8]}|B I I I I I I I I
689|Imagine the groids licking their big lips when they see all those unsuspecting tourists walking around .|{'start': [2], 'end': [2]}|O O B O O O O O O O O O O O O O O
690|Islamic are criminals: they rape, enslave and murder people. Islam is more a worship than a religion and we do not have anything to share with them.|{'start': [0], 'end': [8]}|B I I I I I I I I O O O O O O O O O O O O O O O O O O
691|A federal judge in New York closed a filthy jew kosher slaughterhouse Tuesday , saying the plant ' s dirty birds posed a health risk to the community . |{'start': [8], 'end': [10]}|O O O O O O O O B I I O O O O O O O O O O O O O O O O O O
692|We dont want ppl from 3rd world shithole countries living here . . we have enough problems of our own #StopImmigration entirely . #deport them all .. #MAGA #KeepAmericaGreat #BUILDTHEWALL #GOP|{'start': [7, 20, 23, 29], 'end': [7, 20, 23, 29]}|O O O O O O O B O O O O O O O O O O O O B O O B O O O O O B O
693|@user lmao im finna b a dyke|{'start': [6], 'end': [6]}|O O O O O O B
694|I think that Ramadam will not prevent Muslims from committing terrorist attacks and sexual violence on our children.|{'start': [3], 'end': [17]}|O O O B I I I I I I I I I I I I I I
695|Islam is Evil! That is one word that can describe it. We are in trouble as this evil is taking over countries and nations! Remember our Holy Scriptures? You shall not envy anyone anything. This includes other countries territory. Stop Islam spreading!|{'start': [0, 39], 'end': [2, 41]}|B I I O O O O O O O O O O O O O O O O O O O O O O O O O O O O O O O O O O O O B I I
696|i'd get on yo ass just like some britches , my girl ah woop yo ho she throw dem bitches|{'start': [8, 19], 'end': [8, 19]}|O O O O O O O O B O O O O O O O O O O B
697|". @user From now on , I'll use "" Little Girl "" . Except it insults preteen females comparing them to feminists ."|{'start': [9, 16, 21], 'end': [10, 17, 21]}|O O O O O O O O O B I O O O O O B I O O O B O
698|The situation is dramatic: British laws do not protect the victims of Muslim rapists! We need to make laws only for Muslims. We cannot do much because the politicians are totally surrendered to Islam.|{'start': [12], 'end': [13]}|O O O O O O O O O O O O B I O O O O O O O O O O O O O O O O O O O O
699|we need nigger control|{'start': [2], 'end': [2]}|O O B O
700|Subtweet me one more time , you dirty chink whore . |{'start': [7], 'end': [9]}|O O O O O O O B I I O
701|Today I went to the swimming baths with my son, but there was a section that was only reserved for Muslims. I am thinking of what would occur if I, a white British citizen, asked for a reserved section. This is a submission to Islamics.|{'start': [14, 42], 'end': [20, 44]}|O O O O O O O O O O O O O O B I I I I I I O O O O O O O O O O O O O O O O O O O O O B I I
702|Let Put This Lil Corny Bitch In A Hole And Throw Cheetos At Her @url|{'start': [4], 'end': [5]}|O O O O B I O O O O O O O O O
703|@user club diego tho stripper poles stripper hoes|{'start': [6], 'end': [7]}|O O O O O O B I
704|@user @user Agree with your idea to use the Army to build the wall ! Do it ! #BuildThatWall #BuildTheWall|{'start': [18, 19], 'end': [18, 19]}|O O O O O O O O O O O O O O O O O O B I
705|The problem is in blacks ' heads , but hey , you have already known that . |{'start': [4], 'end': [4]}|O O O O B O O O O O O O O O O O O
706|5000 white men in pick up trucks screaming nigger and my coach got the nerve to get mad I missed the free throw|{'start': [1, 8], 'end': [1, 8]}|O B O O O O O O B O O O O O O O O O O O O O O
707|Because the communist party was almost all jew out to kill any gentile that stood in their way or had property that the jew - communist wanted .|{'start': [7, 24], 'end': [7, 24]}|O O O O O O O B O O O O O O O O O O O O O O O O B O O O
708|"@user @user @user How about discussing this ? #JoeBiden's "" black box "" of American success . #WhiteGenocide #ImmigrationInvasion #JesseWatters #WatersWorld @url"|{'start': [17], 'end': [17]}|O O O O O O O O O O O O O O O O O B O O O O
709|Fuck woman who make false accusations of rape . You are a piece of poop @user|{'start': [0, 7], 'end': [0, 7]}|B O O O O O O B O O O O O O O O
710|True If @user loses midterms it will be because they failed to Keep Their Promises - #RepealObamacare #BuildTheWall #NoAmnesty #NoDACAdeal #EndChainMigration #MandateEverify|{'start': [16, 17, 19], 'end': [16, 17, 19]}|O O O O O O O O O O O O O O O O B I O B O O
711|@user @user To ignore the role of the immigration invasion and White Genocide in the housing disaster isn't just irresponsible , its criminal . @url|{'start': [8, 11], 'end': [8, 12]}|O O O O O O O O B O O B I O O O O O O O O O O O O
712|Don't call Islam a peaceful religion. Consult the evidence on Muslim child rapists. Children were raped by more than 10 people in a night, up to 100 in a week. Why is the media ignoring this?|{'start': [10], 'end': [29]}|O O O O O O O O O O B I I I I I I I I I I I I I I I I I I I O O O O O O
713|the flag of the maga fags in all it glory it comes with nigger red shoes too|{'start': [13], 'end': [15]}|O O O O O O O O O O O O O B I I O
714|and all this butthurt faggotry just makes me want to join twp to spite you queers|{'start': [3, 10], 'end': [4, 15]}|O O O B I O O O O O B I I I I I
715|lying msm sure dropped this muzrat terrorist attack quick|{'start': [5], 'end': [7]}|O O O O O B I I O
716|@user also about how she like raped the principal in season |{'start': [6], 'end': [6]}|O O O O O O B O O O O
717|Hijiab represents Islam and this religion represents the women subjugation and the persecution of child, rapes, narrow-mindness, chauvinism. I do not like the hijab and everything that implicates!|{'start': [0], 'end': [17]}|B I I I I I I I I I I I I I I I I I O O O O O O O O O O
718|How incompetent was Obama doesnt know were wall goes on the border not around . #BuildThatWall #BuildTheWall #obamalegacy #obamalibrary|{'start': [16, 17], 'end': [16, 17]}|O O O O O O O O O O O O O O O O B I O
719|well well niggers and beaners are murderous animals who da thunk it|{'start': [2], 'end': [7]}|O O B I I I I I O O O O
720|if your ex is treating their new thang better than they ever treated you forget that hoe|{'start': [16], 'end': [16]}|O O O O O O O O O O O O O O O O B
721|#INeedMeninism Because watching feminists / their lapdogs have conniptions & mock a movement created solely to mock THEIR movement = TOO funny .|{'start': [0, 3, 5], 'end': [0, 3, 8]}|B O O B O B I I I O O O O O O O O O O O O O O
722|When you finally get the bitch to leave @user|{'start': [5], 'end': [5]}|O O O O O B O O O
723|Muslims, their texts as hate literature, and other manifestations of hate and genocide should be eradicated. We should have no tolerance towards this cult of hate! Imprison supporters of Islam, wake up Britain!|{'start': [2, 8, 19, 26], 'end': [5, 15, 25, 29]}|O O B I I I O O B I I I I I I I O O O B I I I I I I I I I I O O O
724|Loool I tried using my card abroad n the cunt hoe sket worker was like ' ur card declined maybe u dnt have enough ' @url|{'start': [10], 'end': [10]}|O O O O O O O O O O B O O O O O O O O O O O O O O O
725|weed guys the most emotional niggas ever|{'start': [5], 'end': [5]}|O O O O O B O
726|Karma's a bitch , right @user ? #MKR #MKR2015|{'start': [2, 7, 8, 8], 'end': [2, 7, 8, 8]}|O O B O O O O B I
727|""" @user : LMFAOOOO I HATE BLACK PEOPLE @url"|{'start': [5], 'end': [6]}|O O O O O B I O O
728|divide you are a fucking spic rapists and criminals get the fuck out beaner|{'start': [4, 9], 'end': [6, 13]}|O O O O B I I O O B I I I I
729|Says the bitch wit a HAT , WEAVE , & a FULL FACE , in her ICON ... lol fucc outta here you SEWER RAT , GUTTER SLUT , TRO @url|{'start': [2, 27], 'end': [2, 27]}|O O B O O O O O O O O O O O O O O O O O O O O O O O O B O O O
730|@user What a liar - get the story I paid him $ 380k after the fact because he attacked me . What a skank and so is every woman who looks the other way on this story because of the greater good .|{'start': [23], 'end': [23]}|O O O O O O O O O O O O O O O O O O O O O O O B O O O O O O O O O O O O O O O O O O O
731|An illegal alien has been charged with murder , arson and mutilation of a corpse n #Democrats Want to make sure more Illegals can cross U . S Border and they want to End #ICE #Trump #MAGA #RedNationRising @user #Immigration @url|{'start': [1, 22], 'end': [2, 22]}|O B I O O O O O O O O O O O O O O O O O O O B O O O O O O O O O O O O O O O O O O
732|just saw a hershey ' s commercial on tv , ca n't find it on jewtube shows a White woman happily sharing candy with some mop headed groid male on an escalator guess I wo n't be buying that stuff ever again |{'start': [15, 18], 'end': [15, 18]}|O O O O O O O O O O O O O O O B O O B O O O O O O O O O O O O O O O O O O O O O O O
733|Are there any whites left in that craphole or have they all been killed ?|{'start': [7], 'end': [7]}|O O O O O O O B O O O O O O O
734|There are muslim shops in Birmingham that do not serve their white clients and have signs that say:'No Whites after 8 p.m.'.|{'start': [2], 'end': [3]}|O O B I O O O O O O O O O O O O O O O O O O
735|i think it is because you are full of shit and refuse to budge on the kike narrative that you have been brainwashed to believe is the only way forward|{'start': [7, 16], 'end': [9, 16]}|O O O O O O O B I I O O O O O O B O O O O O O O O O O O O O
736|Muslims are not civilised and Europe does not want them.|{'start': [0], 'end': [3]}|B I I I O O O O O O
737|shoutout to every cishet man who had a crush on me you all are faggots|{'start': [14], 'end': [14]}|O O O O O O O O O O O O O O B
738|@user So this bitch blocked me but check her pinned tweet out , she is accusing men of rape on tumblr with @url|{'start': [3, 18], 'end': [3, 18]}|O O O B O O O O O O O O O O O O O O B O O O O
739|this site still sucks nigger dick|{'start': [3], 'end': [5]}|O O O B I I
740|Illegal Alien With History Of Child Sexual Assault Has Raped Another Child @user @user NEED TO PUT A STOP TO THIS ! #BuildTheWall #NoAmnestyEver #NoDACA #DeportThemAll #KeepAmericansSafe In other words , DO YOUR JOB ! |{'start': [0, 6, 9, 22, 25], 'end': [1, 7, 9, 22, 25]}|B I O O O O B I O B O O O O O O O O O O O O B O O B O O O O O O O O O
741|I do n't know ... if afrocant ' s do n't slather their skin several times a day with cocoa butter lotion it takes on a definite crocodilian appearance .|{'start': [6, 27], 'end': [6, 27]}|O O O O O O B O O O O O O O O O O O O O O O O O O O O B O O
742|ur nazi ur nazi u am nazi is usually the only argument the kike can come up with they are never able to come up with anything to say to try to prove the other person wrong|{'start': [13], 'end': [13]}|O O O O O O O O O O O O O B O O O O O O O O O O O O O O O O O O O O O O O
743|These 8 crooks are all Muslims and every one of their victims is Non-Muslim, white-British. Why do these criminals only target White British Non-Muslims?|{'start': [1], 'end': [5]}|O B I I I I O O O O O O O O O O O O O O O O O O
744|showa time for this fucking kike|{'start': [4], 'end': [5]}|O O O O B I
745|Illegal immigrants from Bangladesh , Afg r playing havoc in India.High time Mamta & Immigration office take a note , if they have any concern |{'start': [0], 'end': [1]}|B I O O O O O O O O O O O O O O O O O O O O O O O
746|all the other songs on this playlist called me faggot|{'start': [9], 'end': [9]}|O O O O O O O O O B
747|how can the kike apologist negate this one you can not admit it they are scum everything you learned in school except math and grammar was a lie|{'start': [3], 'end': [3]}|O O O B O O O O O O O O O O O O O O O O O O O O O O O O
748|18 Images You Won't Believe Exist On Google Maps #QAnon #Elections2018 #CorruptGovernment #GoogleIsCIA #ChildSexTrafficking #AmericaFirst #BuildTheWALL #ThesePeopleAreEVIL #NoDACA #GreatAwakening|{'start': [15, 16], 'end': [15, 16]}|O O O O O O O O O O O O O O O B I O O
749|If not kept in check , we may very well be living in an actual Planet of the Apes soon . |{'start': [18], 'end': [18]}|O O O O O O O O O O O O O O O O O O B O O
750|@user @user poor buggers perhaps they should not have raped and beaten children|{'start': [2, 9], 'end': [3, 12]}|O O B I O O O O O B I I I
